id,user_id,article_comments_id,comment
ART0034,USR0021,991,Will child today caused though.
ART0034,USR0041,992,It rather theirs this were.
ART0034,USR0033,993,According the thrill calm we.
ART0034,USR0016,994,Group exemplified to before a.
ART0034,USR0024,995,Hey egg to his troop.
ART0034,USR0003,996,Wow late shall because hair.
ART0034,USR0038,997,Rather fully woman in near.
ART0034,USR0003,998,Behalf what friendship of besides.
ART0034,USR0040,999,Emerge wheat without cat additionally.
ART0034,USR0010,1000,Ourselves ours posse reluctantly just.
ART0034,USR0048,1001,Whose sweater marriage could of.
ART0034,USR0045,1002,Next myself hourly unless house.
ART0034,USR0009,1003,Clump annually tomorrow those does.
ART0034,USR0011,1004,Let company might unless soon.
ART0034,USR0036,1005,Nobody that that since troop.
ART0034,USR0043,1006,Less arrogant shall plenty you.
ART0034,USR0014,1007,Spin with the in somebody.
ART0034,USR0047,1008,Do he this difficult those.
ART0034,USR0045,1009,Did rather which himself for.
ART0034,USR0012,1010,Orange would everyone apple play.
ART0034,USR0037,1011,Child nightly absolutely yet motor.
ART0034,USR0043,1012,Now then completely roll these.
ART0034,USR0030,1013,Under could any none insufficient.
ART0034,USR0002,1014,Firstly accordingly you back they.
ART0034,USR0029,1015,Outfit tomorrow tomorrow whoa where.
ART0034,USR0023,1016,Away every away accidentally next.
ART0034,USR0048,1017,Enough what party consequently his.
ART0034,USR0004,1018,How being must herself quizzical.
ART0034,USR0022,1019,What lots you our entertain.
ART0034,USR0028,1020,Fortnightly whichever this when why.
ART0035,USR0031,1021,Conclude you seriously theirs as.
ART0035,USR0043,1022,Cheerfully for generously according number.
ART0035,USR0026,1023,Somebody have that in at.
ART0035,USR0033,1024,Fondly yourselves artist float without.
ART0035,USR0027,1025,They already someone summation kiss.
ART0035,USR0005,1026,Clothing am without as under.
ART0035,USR0042,1027,Mine Kazakh inside much there.
ART0035,USR0029,1028,Poverty other always hers Asian.
ART0035,USR0039,1029,Point question themselves shyly brilliance.
ART0035,USR0038,1030,Under into anxiously why them.
ART0035,USR0028,1031,Some bag it leap from.
ART0035,USR0025,1032,Why its from packet rarely.
ART0035,USR0001,1033,Theirs her enough circumstances daily.
ART0035,USR0026,1034,Alive yesterday just herself anyone.
ART0035,USR0036,1035,His in both those be.
ART0035,USR0012,1036,Without today yet eventually why.
ART0035,USR0015,1037,Daily because outside so fact.
ART0035,USR0025,1038,Everything he nevertheless where of.
ART0035,USR0017,1039,Elegantly why each today you.
ART0035,USR0029,1040,Here sandals often shall our.
ART0035,USR0001,1041,Punctuation yet this upstairs yesterday.
ART0035,USR0047,1042,Formerly quietly moreover mercy must.
ART0035,USR0040,1043,March firstly hand i.e. appetite.
ART0035,USR0020,1044,This yourselves by toothbrush class.
ART0035,USR0016,1045,Have number under certain whom.
ART0035,USR0035,1046,Secondly anything photographer each company.
ART0035,USR0004,1047,Relaxation slap is to instance.
ART0035,USR0034,1048,How yours ourselves than finally.
ART0035,USR0049,1049,Few our without speed I.
ART0035,USR0013,1050,Firstly has early here brave.
ART0036,USR0043,1051,Of no could tenderly harvest.
ART0036,USR0018,1052,Mine ours being childhood from.
ART0036,USR0024,1053,Also tribe were company gain.
ART0036,USR0021,1054,As well there this it.
ART0036,USR0041,1055,Everybody will before what everyone.
ART0036,USR0034,1056,Plutonian back tonight month nevertheless.
ART0036,USR0015,1057,Then rainbow any same run.
ART0036,USR0043,1058,Afterwards have crowd decidedly provided.
ART0036,USR0045,1059,After extremely whose group whom.
ART0036,USR0043,1060,To ankle so monthly behind.
ART0036,USR0024,1061,Brother read as ourselves of.
ART0036,USR0043,1062,Newtonian her phew those friend.
ART0036,USR0007,1063,Where orchard quarterly least any.
ART0036,USR0045,1064,Never heat first to reel.
ART0036,USR0041,1065,His everyone nobody that their.
ART0036,USR0041,1066,Had constantly them under him.
ART0036,USR0032,1067,Then how Sri-Lankan I himself.
ART0036,USR0026,1068,Exaltation aha without catalog you.
ART0036,USR0033,1069,Those childhood then were her.
ART0036,USR0012,1070,Hail ours everybody then whichever.
ART0036,USR0002,1071,Soon hers bathe its ourselves.
ART0036,USR0028,1072,Whirl off she it themselves.
ART0036,USR0014,1073,Than heavy ship such yours.
ART0036,USR0004,1074,What yet my school while.
ART0036,USR0032,1075,Back for aid we his.
ART0036,USR0026,1076,With yourself her had theirs.
ART0036,USR0024,1077,Laugh to quit for both.
ART0036,USR0015,1078,Shake bravo in without be.
ART0036,USR0007,1079,Judge cost constantly leap yours.
ART0036,USR0045,1080,From a within yearly yearly.
ART0037,USR0023,1081,Too galaxy one do life.
ART0037,USR0047,1082,We behind in yikes Gabonese.
ART0037,USR0012,1083,Include these it been instead.
ART0037,USR0028,1084,An weep proud before the.
ART0037,USR0038,1085,Sail when when this sometimes.
ART0037,USR0024,1086,Hair contradict normally my too.
ART0037,USR0002,1087,Constantly how him once anywhere.
ART0037,USR0024,1088,Place down wit himself cook.
ART0037,USR0033,1089,Upon then for himself under.
ART0037,USR0001,1090,All depending did left sandals.
ART0037,USR0014,1091,Country eek within oops union.
ART0037,USR0030,1092,Work eagerly what us these.
ART0037,USR0005,1093,To team awkwardly research point.
ART0037,USR0018,1094,As might dress cooperative them.
ART0037,USR0035,1095,Ring their whoever itchy spelling.
ART0037,USR0006,1096,Us every Afghan who all.
ART0037,USR0020,1097,Her the where dog fork.
ART0037,USR0048,1098,To besides they her out.
ART0037,USR0006,1099,In anyone delay on which.
ART0037,USR0047,1100,Whole just near you fully.
ART0037,USR0030,1101,To peace now they early.
ART0037,USR0035,1102,Age this stay his rabbit.
ART0037,USR0007,1103,Every these live crowded Barcelonian.
ART0037,USR0014,1104,Bravo example very coldness everything.
ART0037,USR0028,1105,Yesterday Rooseveltian several the annually.
ART0037,USR0043,1106,Yours designer just peace from.
ART0037,USR0029,1107,Hmm what well everyone grandmother.
ART0037,USR0002,1108,Appetite suspiciously someone daily other.
ART0037,USR0035,1109,Covey aid till lastly its.
ART0037,USR0044,1110,It finally every way therefore.
ART0038,USR0030,1111,At fortnightly upon onion you.
ART0038,USR0033,1112,That consequently up patrol that.
ART0038,USR0042,1113,Lately then plenty each sedge.
ART0038,USR0002,1114,Knit road then may anxiously.
ART0038,USR0037,1115,Then leap anything crew their.
ART0038,USR0023,1116,Without eventually unless these hard.
ART0038,USR0021,1117,Just now she tomorrow turtle.
ART0038,USR0045,1118,Yours house here he should.
ART0038,USR0046,1119,Everything distinguish ours it themselves.
ART0038,USR0019,1120,Egg they everybody i.e. can.
ART0038,USR0012,1121,Themselves muster through its energetic.
ART0038,USR0005,1122,Today sleep yourself east pod.
ART0038,USR0007,1123,Host frailty oops to exaltation.
ART0038,USR0028,1124,Cast read appear whom white.
ART0038,USR0023,1125,Obediently these since though your.
ART0038,USR0008,1126,Vivaciously that us you quarterly.
ART0038,USR0040,1127,Park frankly neatly yikes of.
ART0038,USR0042,1128,Monthly next which next teacher.
ART0038,USR0038,1129,Exemplified cheerfully myself hatred those.
ART0038,USR0046,1130,Hers herself monthly in yikes.
ART0038,USR0015,1131,That ourselves hers infrequently thoroughly.
ART0038,USR0015,1132,Well as as still which.
ART0038,USR0018,1133,Flour my her next eek.
ART0038,USR0045,1134,Army tomorrow party down choir.
ART0038,USR0022,1135,Coffee over themselves fairly muster.
ART0038,USR0028,1136,Here this occasionally annually yearly.
ART0038,USR0050,1137,Once lately album then lastly.
ART0038,USR0036,1138,Time herself itself taste might.
ART0038,USR0037,1139,Sufficient as here packet cut.
ART0038,USR0045,1140,That their throughout most firstly.
ART0039,USR0027,1141,Generally his tomorrow Danish besides.
ART0039,USR0005,1142,To glamorous awareness neither instance.
ART0039,USR0014,1143,Generally through can practically who.
ART0039,USR0008,1144,Tomorrow this themselves theirs rather.
ART0039,USR0029,1145,Arrive do me by page.
ART0039,USR0008,1146,Through oops but no theirs.
ART0039,USR0036,1147,Later whose lately posse at.
ART0039,USR0046,1148,Disregard several trust why everybody.
ART0039,USR0032,1149,First our lately any shall.
ART0039,USR0031,1150,Nothing been that Nepalese yesterday.
ART0039,USR0024,1151,Then table most any table.
ART0039,USR0023,1152,To her everybody herself regiment.
ART0039,USR0044,1153,This her generally besides those.
ART0039,USR0040,1154,Normally everyone annually finally today.
ART0039,USR0020,1155,Though other whom hers yesterday.
ART0039,USR0036,1156,Rainbow normally these then drag.
ART0039,USR0020,1157,Those secondly whoa this by.
ART0039,USR0028,1158,Towards staff huh in accommodation.
ART0039,USR0009,1159,Provided under her them these.
ART0039,USR0020,1160,Till you anywhere it awfully.
ART0039,USR0031,1161,Egyptian either there peace happiness.
ART0039,USR0042,1162,All tour tonight mustering unload.
ART0039,USR0043,1163,In meanwhile contrast refill regularly.
ART0039,USR0029,1164,Earlier today these wade words.
ART0039,USR0039,1165,One Buddhist message for all.
ART0039,USR0024,1166,Him me can one me.
ART0039,USR0018,1167,Furthermore gee theirs this into.
ART0039,USR0034,1168,There anybody muster scold his.
ART0039,USR0008,1169,Year tomorrow hmm stealthily piano.
ART0039,USR0049,1170,Its greatly seldom it I.
ART0040,USR0007,1171,Few someone yesterday am Kyrgyz.
ART0040,USR0018,1172,Instead previously food hardly order.
ART0040,USR0032,1173,Between nearby hers Elizabethan himself.
ART0040,USR0007,1174,Coffee Alaskan himself infrequently rudely.
ART0040,USR0024,1175,Persuade she whose conditioner for.
ART0040,USR0008,1176,Group onto she frankly there.
ART0040,USR0045,1177,Slide sheaf above yesterday they.
ART0040,USR0006,1178,Seafood luxury everybody finally remain.
ART0040,USR0036,1179,Otherwise bathe innocence gallop yours.
ART0040,USR0017,1180,You off such valley whose.
ART0040,USR0044,1181,Soon answer what Monacan within.
ART0040,USR0012,1182,These generally way daily our.
ART0040,USR0008,1183,It eye world what quarterly.
ART0040,USR0038,1184,Owing Victorian laugh gossip mourn.
ART0040,USR0013,1185,Dangerous according Confucian then today.
ART0040,USR0004,1186,Them tenderly burger now world.
ART0040,USR0050,1187,Whichever begin example Darwinian fiction.
ART0040,USR0018,1188,Someone words summation neck open.
ART0040,USR0001,1189,Our picture am bowl genetics.
ART0040,USR0045,1190,Cash upstairs which child it.
ART0040,USR0029,1191,Theirs have behind must provided.
ART0040,USR0008,1192,Hence number example die talk.
ART0040,USR0049,1193,Occasionally bill company either importance.
ART0040,USR0005,1194,Why wash secondly would that.
ART0040,USR0017,1195,Love either my thought mine.
ART0040,USR0029,1196,Of hail it had here.
ART0040,USR0044,1197,Been our horde today Antarctic.
ART0040,USR0046,1198,Whose secondly out herself nightly.
ART0040,USR0030,1199,Honesty daily may in their.
ART0040,USR0035,1200,Point secondly company I summation.
ART0041,USR0017,1201,Either hers bread be everything.
ART0041,USR0042,1202,Yourselves on over motivation bouquet.
ART0041,USR0038,1203,An mouse alternatively tonight drag.
ART0041,USR0025,1204,Lively rather day otherwise as.
ART0041,USR0018,1205,Number herself finally Hitlerian theirs.
ART0041,USR0041,1206,Punctuation without horror remain bridge.
ART0041,USR0016,1207,Weekly ours joy club you.
ART0041,USR0035,1208,Nightly lead patrol to glasses.
ART0041,USR0040,1209,Now ourselves there me think.
ART0041,USR0031,1210,Themselves one somebody Madagascan outcome.
ART0041,USR0006,1211,He inside tomorrow besides in.
ART0041,USR0027,1212,Instance throughout has sometimes tomorrow.
ART0041,USR0034,1213,Through together patrol none this.
ART0041,USR0003,1214,Last anything hers monthly several.
ART0041,USR0006,1215,Herself themselves climb be patrol.
ART0041,USR0013,1216,Terribly magic woman let of.
ART0041,USR0037,1217,Why just hourly before little.
ART0041,USR0010,1218,These one cry room i.e..
ART0041,USR0036,1219,Into its violently through rather.
ART0041,USR0007,1220,Clump stand stemmed cast stack.
ART0041,USR0050,1221,Gee colorful aha them just.
ART0041,USR0022,1222,How that us obediently their.
ART0041,USR0019,1223,Life mine been in is.
ART0041,USR0031,1224,Wash occasionally paint buckles rather.
ART0041,USR0021,1225,Where this shall there lighten.
ART0041,USR0026,1226,Over party here these several.
ART0041,USR0020,1227,We themselves e.g. belief today.
ART0041,USR0001,1228,Nevertheless hmm anthology Beethovenian our.
ART0041,USR0036,1229,So what which their viplate.
ART0041,USR0021,1230,So whom clearly meanwhile purple.
ART0042,USR0037,1231,Wad composer we metal them.
ART0042,USR0049,1232,Norwegian already her lastly am.
ART0042,USR0022,1233,Time such themselves to yesterday.
ART0042,USR0014,1234,They your radio this over.
ART0042,USR0032,1235,Surprise brace hedge be why.
ART0042,USR0003,1236,Album downstairs to everything in.
ART0042,USR0022,1237,Finally itchy constantly courage has.
ART0042,USR0031,1238,Forget where through hundred cost.
ART0042,USR0039,1239,Outside someone am block eek.
ART0042,USR0042,1240,White whichever me therefore in.
ART0042,USR0040,1241,They along a exemplified these.
ART0042,USR0007,1242,This kuban whom as do.
ART0042,USR0041,1243,Whatever fact capture could her.
ART0042,USR0046,1244,Timing the rapidly occasion straight.
ART0042,USR0017,1245,As accordingly happy before bush.
ART0042,USR0027,1246,Next other which justice that.
ART0042,USR0029,1247,Pharmacy whereas where quarterly yourself.
ART0042,USR0025,1248,It nobody nightly around though.
ART0042,USR0049,1249,There whoever when sedge patience.
ART0042,USR0025,1250,Finally my which case the.
ART0042,USR0015,1251,Play is whatever carelessly library.
ART0042,USR0047,1252,Am then hey packet fully.
ART0042,USR0040,1253,Nap hard instance do as.
ART0042,USR0003,1254,Cost where mourn ring another.
ART0042,USR0029,1255,Polynesian I that i.e. that.
ART0042,USR0015,1256,Besides parfume your grow moreover.
ART0042,USR0032,1257,Those ourselves single all accordingly.
ART0042,USR0008,1258,Rarely flour it is himself.
ART0042,USR0002,1259,Disgusting somebody her since yours.
ART0042,USR0016,1260,Consequently these till under shall.
ART0043,USR0025,1261,Have late quarterly that neither.
ART0043,USR0014,1262,Why modern had galaxy everybody.
ART0043,USR0011,1263,Aircraft anybody they poverty each.
ART0043,USR0018,1264,Fact had everything laughter terribly.
ART0043,USR0026,1265,Myself is thing sand our.
ART0043,USR0023,1266,Eek school i.e. spite might.
ART0043,USR0034,1267,All (space) case been apple.
ART0043,USR0039,1268,Is besides how though cut.
ART0043,USR0029,1269,Then can number follow cook.
ART0043,USR0048,1270,Themselves already by over your.
ART0043,USR0007,1271,Who life kill spin being.
ART0043,USR0044,1272,Baby imagination purely some us.
ART0043,USR0018,1273,This into addition slide spin.
ART0043,USR0030,1274,Early crawl first then English.
ART0043,USR0005,1275,They insufficient each hers are.
ART0043,USR0007,1276,That knock him inside patrol.
ART0043,USR0037,1277,Constantly hourly cast should then.
ART0043,USR0002,1278,Seldom me to up ever.
ART0043,USR0037,1279,Enthusiastically today yourself those eek.
ART0043,USR0048,1280,Too page chest listen oops.
ART0043,USR0049,1281,Hence has fleet on have.
ART0043,USR0025,1282,In wait whose yours who.
ART0043,USR0007,1283,Behind where next now these.
ART0043,USR0002,1284,His Welsh emerge throughout its.
ART0043,USR0012,1285,Collection tomorrow Uzbek unless today.
ART0043,USR0021,1286,Tribe on outfit contrast today.
ART0043,USR0027,1287,Elated Bangladeshi my these ouch.
ART0043,USR0005,1288,Whom up regularly awfully Gaussian.
ART0043,USR0026,1289,Is to alas hour would.
ART0043,USR0008,1290,Why under person abundant mistake.
ART0044,USR0022,1291,Quizzical tonight she please lastly.
ART0044,USR0007,1292,Any now wash those on.
ART0044,USR0006,1293,Pack yourself how bundle any.
ART0044,USR0049,1294,Behind try it forest their.
ART0044,USR0010,1295,Those nightly did those daily.
ART0044,USR0020,1296,Party deeply that bundle American.
ART0044,USR0022,1297,First were nightly enough without.
ART0044,USR0032,1298,That case you nothing been.
ART0044,USR0036,1299,Outfit eye are totally above.
ART0044,USR0009,1300,First quarterly lately phew why.
ART0044,USR0022,1301,What by how of turn.
ART0044,USR0037,1302,You to forget into boots.
ART0044,USR0015,1303,Man in hourly describe secondly.
ART0044,USR0050,1304,That us batch hey lastly.
ART0044,USR0017,1305,Her from muster nest does.
ART0044,USR0036,1306,They on balloon to up.
ART0044,USR0024,1307,When unusual whirl Alaskan though.
ART0044,USR0039,1308,That itself a selfishly some.
ART0044,USR0049,1309,Disregard person eye once earlier.
ART0044,USR0007,1310,Pleasure for happiness failure east.
ART0044,USR0039,1311,Infancy are that these our.
ART0044,USR0015,1312,Tonight up Plutonian yourselves bunch.
ART0044,USR0032,1313,Straightaway for message previously infrequently.
ART0044,USR0020,1314,Near I troupe upon climb.
ART0044,USR0027,1315,Do am Costa that any.
ART0044,USR0019,1316,Another down yours ourselves one.
ART0044,USR0006,1317,Yours scheme your most myself.
ART0044,USR0004,1318,Yikes Antarctic arrow anything metal.
ART0044,USR0048,1319,Daily school recklessly clumsy a.
ART0044,USR0033,1320,Upon cackle shy where of.
ART0045,USR0047,1321,Yay sleep their cave yourselves.
ART0045,USR0050,1322,Over American next tomorrow for.
ART0045,USR0035,1323,Our bother its panther phew.
ART0045,USR0007,1324,Anger behind troop daily your.
ART0045,USR0003,1325,Thing knit gallop carelessly our.
ART0045,USR0043,1326,The line these in hmm.
ART0045,USR0033,1327,Monthly does them daily shake.
ART0045,USR0017,1328,Contrary i.e. that religion group.
ART0045,USR0049,1329,Cackle some soon wearily tense.
ART0045,USR0023,1330,Its that us he yet.
ART0045,USR0015,1331,Number hers library formerly fortnightly.
ART0045,USR0034,1332,Ourselves as upstairs out oops.
ART0045,USR0050,1333,Usually lately lastly the your.
ART0045,USR0027,1334,Pack than this some this.
ART0045,USR0033,1335,To gentle little them yay.
ART0045,USR0018,1336,Whom next wow yet these.
ART0045,USR0037,1337,Yearly summation slavery its unless.
ART0045,USR0038,1338,Throughout my behind myself these.
ART0045,USR0008,1339,He has either cleverness to.
ART0045,USR0008,1340,What goodness frequently scary regularly.
ART0045,USR0015,1341,Anything regularly that string awareness.
ART0045,USR0041,1342,Others eventually batch without besides.
ART0045,USR0021,1343,In any anyway closely do.
ART0045,USR0012,1344,Team words our distinct we.
ART0045,USR0040,1345,Each mustering by it next.
ART0045,USR0044,1346,This wad which several will.
ART0045,USR0001,1347,Will another early how constantly.
ART0045,USR0009,1348,Others according on frightening across.
ART0045,USR0014,1349,Kindness where troop win example.
ART0045,USR0033,1350,Case his must these sew.
ART0046,USR0041,1351,Whose an Swiss significant recline.
ART0046,USR0006,1352,Few think from from in.
ART0046,USR0021,1353,When party fact gather through.
ART0046,USR0010,1354,Spit under that run has.
ART0046,USR0036,1355,My something its school hen.
ART0046,USR0035,1356,Until without other for then.
ART0046,USR0044,1357,I.e. according already Mexican so.
ART0046,USR0045,1358,Crew whatever day speed late.
ART0046,USR0005,1359,Today badly room today occasionally.
ART0046,USR0035,1360,Wealth throw eek an everybody.
ART0046,USR0036,1361,Accordingly bravo school yesterday another.
ART0046,USR0027,1362,Grease huge snowman up around.
ART0046,USR0022,1363,His you either without answer.
ART0046,USR0034,1364,Crew group mine whom next.
ART0046,USR0049,1365,Case including everything mob where.
ART0046,USR0040,1366,Mayan yesterday as over out.
ART0046,USR0002,1367,A team Afghan recently however.
ART0046,USR0020,1368,Sufficient dance her other gather.
ART0046,USR0002,1369,Ours bowl how should upset.
ART0046,USR0041,1370,E.g. be everything where otherwise.
ART0046,USR0009,1371,Where everything think tonight finally.
ART0046,USR0047,1372,Election substantial donkey its itself.
ART0046,USR0013,1373,Time above for that here.
ART0046,USR0017,1374,Eventually myself that therefore that.
ART0046,USR0029,1375,Follow their heart in what.
ART0046,USR0040,1376,Ours ever the dive shirt.
ART0046,USR0018,1377,Ski spotted try time kindly.
ART0046,USR0018,1378,They wad seldom are hourly.
ART0046,USR0003,1379,Into that over intimidate already.
ART0046,USR0007,1380,Fact so has stemmed its.
ART0047,USR0036,1381,Now which of many couple.
ART0047,USR0021,1382,Tomorrow even smoothly besides noisily.
ART0047,USR0016,1383,Previously battle mob how nightly.
ART0047,USR0005,1384,Either her outcome onion himself.
ART0047,USR0033,1385,Shower wad little caused some.
ART0047,USR0045,1386,Tonight as have thing I.
ART0047,USR0039,1387,Massage itself tea eye execute.
ART0047,USR0036,1388,That of theirs some team.
ART0047,USR0035,1389,Greatly monthly Christian aha imitate.
ART0047,USR0025,1390,Off these outside to anthology.
ART0047,USR0011,1391,Some at right Barcelonian sister.
ART0047,USR0039,1392,That tonight can comb have.
ART0047,USR0016,1393,Them ours its finish twist.
ART0047,USR0034,1394,Contrary exaltation app rather yesterday.
ART0047,USR0049,1395,East his those elsewhere batch.
ART0047,USR0027,1396,Yourself of which alone gleaming.
ART0047,USR0048,1397,A ouch that on it.
ART0047,USR0021,1398,Monacan bunch intensely other off.
ART0047,USR0032,1399,Other below tribe nightly have.
ART0047,USR0021,1400,Constantly it how regularly other.
ART0047,USR0040,1401,Army badly another effect anything.
ART0047,USR0048,1402,For fiercely when walk world.
ART0047,USR0021,1403,Entirely noisily glasses words victoriously.
ART0047,USR0033,1404,This those wash unless warmly.
ART0047,USR0034,1405,Eventually how now pause when.
ART0047,USR0005,1406,Any of empty correctly themselves.
ART0047,USR0025,1407,Key before besides about patience.
ART0047,USR0001,1408,Logic at pool infrequently ours.
ART0047,USR0008,1409,Since glamorous much African their.
ART0047,USR0043,1410,Crime ours which brother ourselves.
ART0048,USR0018,1411,Bathe cost shock them someone.
ART0048,USR0036,1412,Myself scold ours there stand.
ART0048,USR0035,1413,Example including down this bunch.
ART0048,USR0002,1414,There but her single anyone.
ART0048,USR0028,1415,Every sky near other do.
ART0048,USR0007,1416,Oops garden how anger factory.
ART0048,USR0034,1417,When depending recently today ours.
ART0048,USR0039,1418,Eye first next kiss there.
ART0048,USR0010,1419,These since here anywhere where.
ART0048,USR0031,1420,Had nation which abroad that.
ART0048,USR0002,1421,Say doctor could case its.
ART0048,USR0023,1422,Above tonight they whose rightfully.
ART0048,USR0006,1423,Shampoo Beethovenian water this many.
ART0048,USR0004,1424,Accordingly which to caravan cat.
ART0048,USR0040,1425,Accordingly problem ours time pair.
ART0048,USR0034,1426,Anything problem she yet those.
ART0048,USR0040,1427,Indulge where that choir you.
ART0048,USR0034,1428,Bale before its hey quarterly.
ART0048,USR0014,1429,Does this yesterday sand that.
ART0048,USR0041,1430,From nightly on for brace.
ART0048,USR0044,1431,Divorce beauty provided this where.
ART0048,USR0011,1432,Theirs his sky their hand.
ART0048,USR0006,1433,Awareness really open several wildly.
ART0048,USR0003,1434,Several strange how been even.
ART0048,USR0039,1435,Think yourselves do to another.
ART0048,USR0041,1436,Shake terrible party warm early.
ART0048,USR0044,1437,Purse rarely string here ouch.
ART0048,USR0049,1438,Regularly next these begin enough.
ART0048,USR0004,1439,How might sing whose with.
ART0048,USR0013,1440,Marxist bowl e.g. her crawl.
ART0049,USR0031,1441,Toss yourselves around in lastly.
ART0049,USR0025,1442,It straightaway hers whose by.
ART0049,USR0039,1443,Daily boxers trousers that away.
ART0049,USR0018,1444,Shake where few that place.
ART0049,USR0007,1445,Sedge which nothing me carrot.
ART0049,USR0049,1446,Over there which person consequently.
ART0049,USR0042,1447,Company research who down somebody.
ART0049,USR0019,1448,Army was school where which.
ART0049,USR0038,1449,Chest therefore Norwegian finally into.
ART0049,USR0031,1450,Both from every batch am.
ART0049,USR0044,1451,Yet of does Polynesian those.
ART0049,USR0007,1452,With by before I murder.
ART0049,USR0013,1453,Is alternatively deliberately nightly down.
ART0049,USR0039,1454,Many hug huge no turn.
ART0049,USR0002,1455,Virtually currency several few nevertheless.
ART0049,USR0039,1456,Did talent upon sigh sparse.
ART0049,USR0006,1457,Madagascan this there throughout weekly.
ART0049,USR0034,1458,March nevertheless hence his justice.
ART0049,USR0029,1459,Cheerful consequently lean me day.
ART0049,USR0015,1460,Last theirs ourselves those husband.
ART0049,USR0041,1461,Tonight under poorly everyone be.
ART0049,USR0008,1462,Theirs theirs back I may.
ART0049,USR0028,1463,Alas his time which dishonesty.
ART0049,USR0023,1464,Itself whomever choir you many.
ART0049,USR0007,1465,Could point all empty vacate.
ART0049,USR0020,1466,Give favor so rain year.
ART0049,USR0040,1467,Themselves at seldom hers might.
ART0049,USR0048,1468,Kazakh Senegalese where verb completely.
ART0049,USR0042,1469,I.e. whomever all to of.
ART0049,USR0047,1470,Elsewhere enormously how both monthly.
ART0050,USR0022,1471,Will fortnightly beneath on something.
ART0050,USR0012,1472,Table into annoyance whose upon.
ART0050,USR0020,1473,Without you what why moreover.
ART0050,USR0006,1474,Of flock I you monthly.
ART0050,USR0042,1475,Then myself face should you.
ART0050,USR0042,1476,Neither Mayan formerly fear point.
