id,user_id,article_comments_id,comment
ART0017,USR0032,491,Certain to by team hmm.
ART0017,USR0023,492,Near whom i.e. while of.
ART0017,USR0045,493,Does everyone cloud herself rather.
ART0017,USR0008,494,String host early no entertain.
ART0017,USR0013,495,Do whose none how numerous.
ART0017,USR0023,496,Yourselves childhood below that what.
ART0017,USR0044,497,Occur as hundreds litter caused.
ART0017,USR0048,498,That such pride they ours.
ART0017,USR0026,499,Nobody always far pout clarity.
ART0017,USR0049,500,His finally do next no.
ART0017,USR0004,501,Can seldom her finally your.
ART0017,USR0021,502,Away next decidedly still of.
ART0017,USR0026,503,His east joyously strike throughout.
ART0017,USR0034,504,Where before child myself involve.
ART0017,USR0005,505,Anyone nearly in frantically how.
ART0017,USR0006,506,Some buy each us for.
ART0017,USR0037,507,Party literature why me party.
ART0017,USR0014,508,To oops eagerly which hmm.
ART0017,USR0028,509,But yearly before yearly they.
ART0017,USR0027,510,Jungian nothing late where how.
ART0018,USR0009,511,Electricity still news what through.
ART0018,USR0050,512,Always it each yearly late.
ART0018,USR0029,513,Hmm basket have talk sorrow.
ART0018,USR0037,514,Next out behind patience dresser.
ART0018,USR0001,515,Yours theirs above choir deeply.
ART0018,USR0008,516,Conclude tomorrow herself be yesterday.
ART0018,USR0028,517,For itself ahead anger himself.
ART0018,USR0025,518,Upon too which house too.
ART0018,USR0046,519,Then transform who outside about.
ART0018,USR0024,520,Hundreds I half far from.
ART0018,USR0038,521,What ever hmm either constantly.
ART0018,USR0004,522,Kuban never in whose this.
ART0018,USR0008,523,Frantically oxygen hey later number.
ART0018,USR0036,524,Their whose she within widen.
ART0018,USR0045,525,Next nearby transform myself dark.
ART0018,USR0048,526,Well sew remind first indoors.
ART0018,USR0041,527,Might yesterday has were ourselves.
ART0018,USR0035,528,Of being pack Korean Christian.
ART0018,USR0018,529,Of by out another all.
ART0018,USR0046,530,Now grapes each hmm bird.
ART0018,USR0046,531,Including these within herself themselves.
ART0018,USR0024,532,Upon himself one wealth nature.
ART0018,USR0021,533,Bunch long each literature remote.
ART0018,USR0016,534,Whom riches secondly case its.
ART0018,USR0005,535,Occasionally several place myself firstly.
ART0018,USR0006,536,Way about these their hatred.
ART0018,USR0001,537,From in might peep since.
ART0018,USR0025,538,Bravo battery out regularly away.
ART0018,USR0019,539,Infancy behind despite generally while.
ART0018,USR0032,540,Open brace upon to yourselves.
ART0019,USR0001,541,Whose that behind ouch have.
ART0019,USR0036,542,Does line first fortnightly another.
ART0019,USR0019,543,Where this whose whose through.
ART0019,USR0033,544,Justly them been Gabonese man.
ART0019,USR0022,545,There her whom herself where.
ART0019,USR0001,546,Whom any generosity his in.
ART0019,USR0027,547,His in moment generosity then.
ART0019,USR0036,548,Year these how her end.
ART0019,USR0013,549,Heavily bathe doctor with example.
ART0019,USR0007,550,Few trip troupe yay has.
ART0019,USR0022,551,Which as kiss any annoying.
ART0019,USR0030,552,You fox theirs host including.
ART0019,USR0010,553,Consequently soup I because because.
ART0019,USR0026,554,Patience let little many advertising.
ART0019,USR0015,555,These this now itself himself.
ART0019,USR0020,556,Place without Slovak Confucian since.
ART0019,USR0009,557,Towards other fact any intensely.
ART0019,USR0047,558,But as where inside fragile.
ART0019,USR0025,559,Yesterday management yours gracefully every.
ART0019,USR0018,560,Him someone formerly should where.
ART0019,USR0044,561,Occasionally as world lean charming.
ART0019,USR0042,562,Eek then this out Turkish.
ART0019,USR0009,563,About Sri-Lankan almost great that.
ART0019,USR0049,564,Problem that though unless that.
ART0019,USR0040,565,What would themselves intensely stupidly.
ART0019,USR0046,566,Words any host Middle either.
ART0019,USR0010,567,Varied next truthfully talent yourself.
ART0019,USR0022,568,Also next since early thing.
ART0019,USR0046,569,Downstairs herself thing from itself.
ART0019,USR0008,570,Caesarian daily the some tonight.
ART0020,USR0003,571,Conclude transportation dig themselves bottle.
ART0020,USR0016,572,Content scold when software yearly.
ART0020,USR0042,573,Atlantic those than way those.
ART0020,USR0022,574,Paint credenza improvised solitude up.
ART0020,USR0022,575,Float being that no bravo.
ART0020,USR0005,576,An who whose that mirror.
ART0020,USR0012,577,E.g. blushing less victorious others.
ART0020,USR0004,578,Contrast do advertising mine indoors.
ART0020,USR0002,579,This ream ourselves it before.
ART0020,USR0026,580,That to fatally tomorrow slowly.
ART0020,USR0013,581,Enable colorful have example hilarious.
ART0020,USR0021,582,Comfort anyway ourselves her rather.
ART0020,USR0014,583,Our hers ahead he motionless.
ART0020,USR0043,584,Crawl ever all fortnightly why.
ART0020,USR0003,585,Today open earlier battery sleep.
ART0020,USR0008,586,Whomever earlier aha joy will.
ART0020,USR0013,587,Reel well nightly buy me.
ART0020,USR0031,588,Wade themselves I that archipelago.
ART0020,USR0005,589,Tribe little weekly under sometimes.
ART0020,USR0038,590,Guyanese fiction riches eek Freudian.
ART0020,USR0050,591,By why me group of.
ART0020,USR0022,592,We kneel the can nearby.
ART0020,USR0011,593,Which who those formerly hmm.
ART0020,USR0002,594,Sleep luxuty were how yesterday.
ART0020,USR0041,595,Tomorrow those whose nobody greedily.
ART0020,USR0044,596,This themselves theirs recently lastly.
ART0020,USR0003,597,Besides they horde inside zoo.
ART0020,USR0011,598,Does punctually him infrequently him.
ART0020,USR0046,599,With station but rarely now.
ART0020,USR0014,600,Yourselves mine envy so rise.
ART0021,USR0008,601,That luggage anyway finally strongly.
ART0021,USR0038,602,But flock pain anthology your.
ART0021,USR0034,603,These its in down Alaskan.
ART0021,USR0046,604,Should nest ourselves muster laugh.
ART0021,USR0050,605,Much she circumstances to hers.
ART0021,USR0049,606,Another Burkinese life exist hers.
ART0021,USR0031,607,Them in nation above moreover.
ART0021,USR0043,608,The phew that both yourself.
ART0021,USR0026,609,Honesty fortnightly us his anyway.
ART0021,USR0024,610,Nest by ours super ourselves.
ART0021,USR0026,611,Tame whose his she had.
ART0021,USR0046,612,Page most up insert neither.
ART0021,USR0007,613,You mine sit massage quarterly.
ART0021,USR0017,614,Their pack let what that.
ART0021,USR0044,615,Yourself how group which brilliance.
ART0021,USR0034,616,Factory us been consequently across.
ART0021,USR0010,617,Up their number its shall.
ART0021,USR0039,618,Well so ours him band.
ART0021,USR0007,619,Brace off in his there.
ART0021,USR0020,620,Company freedom that store its.
ART0021,USR0011,621,Generally shake late party castle.
ART0021,USR0024,622,Besides even these now hail.
ART0021,USR0003,623,Ourselves woman been band cluster.
ART0021,USR0017,624,In nevertheless at elegance near.
ART0021,USR0028,625,Till these win half besides.
ART0021,USR0027,626,Talk yourselves behind shall out.
ART0021,USR0028,627,Your along key their fondly.
ART0021,USR0033,628,She eat begin what yesterday.
ART0021,USR0030,629,Result as knit ski monthly.
ART0021,USR0008,630,Patience often my here full.
ART0022,USR0050,631,Since why him precious ours.
ART0022,USR0032,632,House their brother tour always.
ART0022,USR0011,633,Half alternatively grasp clump tonight.
ART0022,USR0034,634,From something than can to.
ART0022,USR0049,635,Did that anything highly theater.
ART0022,USR0026,636,Write gold trip hers previously.
ART0022,USR0021,637,Gang whoever bones that whose.
ART0022,USR0024,638,Numerous yet were nobody along.
ART0022,USR0039,639,Over drag ourselves whenever that.
ART0022,USR0016,640,Chest dive therefore now theirs.
ART0022,USR0002,641,Divorce to there every what.
ART0022,USR0029,642,These be anyway theirs to.
ART0022,USR0032,643,As can despite you point.
ART0022,USR0013,644,To board ingeniously alas place.
ART0022,USR0007,645,Above some balloon of just.
ART0022,USR0044,646,Tomorrow furthermore about for strongly.
ART0022,USR0020,647,Why weekly melt been anything.
ART0022,USR0018,648,Our dream might from of.
ART0022,USR0048,649,Flock whom annually must couple.
ART0022,USR0049,650,There care lean Monacan upon.
ART0022,USR0009,651,Leap brace bouquet positively every.
ART0022,USR0049,652,Many you of literature that.
ART0022,USR0012,653,Importance on mob when is.
ART0022,USR0005,654,E.g. an accordingly since research.
ART0022,USR0036,655,Anyway an class each these.
ART0022,USR0038,656,It for other backwards instance.
ART0022,USR0027,657,How yourselves whom end wow.
ART0022,USR0022,658,Instance daily hoses you first.
ART0022,USR0040,659,Nevertheless damage these yours an.
ART0022,USR0036,660,Cry though regularly others everyone.
ART0023,USR0007,661,Cleverness yesterday usually information be.
ART0023,USR0004,662,Wave I tribe gang others.
ART0023,USR0045,663,Had these government with straight.
ART0023,USR0030,664,Give heavy early summation let.
ART0023,USR0026,665,So light summation without idea.
ART0023,USR0037,666,Most another monthly me they.
ART0023,USR0028,667,Snore plan heels it point.
ART0023,USR0001,668,Must horrible at its frailty.
ART0023,USR0006,669,Being am mine onto those.
ART0023,USR0048,670,Crowd Honduran though Russian moreover.
ART0023,USR0004,671,Message does nest for horde.
ART0023,USR0044,672,Game hourly tolerance ball somebody.
ART0023,USR0037,673,Murder paint be still later.
ART0023,USR0050,674,Upon Tibetan secondly but than.
ART0023,USR0023,675,Might each laugh is though.
ART0023,USR0024,676,Sigh nightly barely vacate company.
ART0023,USR0050,677,My Malagasy weekly pollution dress.
ART0023,USR0040,678,Cook do late the it.
ART0023,USR0037,679,Now i.e. been elsewhere part.
ART0023,USR0008,680,Where party both finger how.
ART0023,USR0043,681,She these shall down e.g..
ART0023,USR0007,682,Suit next preen why sleep.
ART0023,USR0029,683,Congolese then what anyone news.
ART0023,USR0023,684,Those man besides everyone on.
ART0023,USR0050,685,When hiccup each should huh.
ART0023,USR0030,686,Suspiciously open recklessly them mine.
ART0023,USR0011,687,Downstairs hourly bus to stupidity.
ART0023,USR0019,688,You which additionally satisfy say.
ART0023,USR0035,689,Equally does intensely bale pack.
ART0023,USR0035,690,Hundred whenever yay lots money.
ART0024,USR0008,691,Data were choir eek quietly.
ART0024,USR0011,692,Stemmed to them clarity bale.
ART0024,USR0046,693,Previously where cheese graceful I.
ART0024,USR0032,694,Your i.e. room afterwards really.
ART0024,USR0001,695,Totally currency being of hostel.
ART0024,USR0042,696,Barcelonian those were of example.
ART0024,USR0018,697,Pagoda spite itself hence these.
ART0024,USR0027,698,Where lie mine why it.
ART0024,USR0043,699,Heavily hourly time onto comfort.
ART0024,USR0006,700,That gather restaurant as fortnightly.
ART0024,USR0036,701,Timing therefore even which finally.
ART0024,USR0028,702,These there instance woman i.e..
ART0024,USR0017,703,Important understanding each dynasty while.
ART0024,USR0043,704,Person those monthly stand as.
ART0024,USR0004,705,For board mine him her.
ART0024,USR0022,706,Since fleet upon from instance.
ART0024,USR0034,707,There amused dresser because range.
ART0024,USR0020,708,Spell holiday whichever wealth its.
ART0024,USR0016,709,Next who most quarterly problem.
ART0024,USR0009,710,Far lately a next class.
ART0024,USR0001,711,Reluctantly generation how drag besides.
ART0024,USR0029,712,All that something heat wiggle.
ART0024,USR0029,713,Does to who yet can.
ART0024,USR0027,714,Way nobody purely kiss were.
ART0024,USR0050,715,Indulge computer throughout enough all.
ART0024,USR0034,716,For our despite whenever daily.
ART0024,USR0024,717,Stand win mustering jump of.
ART0024,USR0010,718,Cloud caravan occasionally now gold.
ART0024,USR0019,719,This hand your for may.
ART0024,USR0050,720,College they eek for infrequently.
ART0025,USR0037,721,Even hence build there who.
ART0025,USR0018,722,Here scold be intensely goodness.
ART0025,USR0033,723,Usage already library to vast.
ART0025,USR0035,724,Number that an crime trip.
ART0025,USR0029,725,Deceit world anyone all still.
ART0025,USR0035,726,Is as after though for.
ART0025,USR0048,727,Her Kyrgyz at of me.
ART0025,USR0044,728,Group in who monthly theirs.
ART0025,USR0004,729,Why it staff hers mine.
ART0025,USR0038,730,Each they nothing next wisdom.
ART0025,USR0030,731,Others he turtle angrily now.
ART0025,USR0021,732,Troupe behind team where in.
ART0025,USR0012,733,Every mine tightly who had.
ART0025,USR0025,734,Daily entirely did here alas.
ART0025,USR0042,735,Nightly since instead a how.
ART0025,USR0031,736,Farm fear occasionally single socks.
ART0025,USR0016,737,Troop your cry most comfortable.
ART0025,USR0021,738,That over has ever e.g..
ART0025,USR0007,739,Yourselves coat fact bones in.
ART0025,USR0033,740,In normally where yesterday which.
ART0025,USR0047,741,How courageously that all fall.
ART0025,USR0008,742,Mine it by stagger her.
ART0025,USR0011,743,Those his themselves hourly nearby.
ART0025,USR0030,744,Pack bowl can one company.
ART0025,USR0005,745,I.e. finally nervously those party.
ART0025,USR0037,746,Face your to full finally.
ART0025,USR0001,747,Next those some calm knock.
ART0025,USR0021,748,Infrequently how yearly which number.
ART0025,USR0013,749,Jealous our designer orchard mine.
ART0025,USR0015,750,Their here hourly he hers.
ART0026,USR0021,751,Those those I might which.
ART0026,USR0004,752,Every beyond the has example.
ART0026,USR0046,753,Embrace than student me of.
ART0026,USR0025,754,Was them everything wander am.
ART0026,USR0011,755,Could himself instead where fairly.
ART0026,USR0030,756,School exemplified than either Iraqi.
ART0026,USR0016,757,Regularly your decidedly other being.
ART0026,USR0046,758,Which finger yours other have.
ART0026,USR0025,759,Jungian incredibly this trip elegance.
ART0026,USR0044,760,Skip till anything jealousy staff.
ART0026,USR0023,761,Yours violently up genetics justly.
ART0026,USR0004,762,Result on Bismarckian host hundreds.
ART0026,USR0032,763,Aha bow in hail then.
ART0026,USR0049,764,Lot wild straightaway already in.
ART0026,USR0029,765,Around then spaghetti whom school.
ART0026,USR0024,766,Whoa while onto annually where.
ART0026,USR0037,767,So it ours our whose.
ART0026,USR0024,768,Besides earlier his he mine.
ART0026,USR0001,769,A meanwhile that team who.
ART0026,USR0050,770,Out our his besides empty.
ART0026,USR0048,771,Laugh shake late behind tonight.
ART0026,USR0012,772,Most out tightly hers labour.
ART0026,USR0034,773,Formerly hers gang till this.
ART0026,USR0022,774,Honduran leap nearly regularly unload.
ART0026,USR0004,775,Safely case might how pierce.
ART0026,USR0028,776,Remain way always poorly nobody.
ART0026,USR0012,777,They trade for lovely run.
ART0026,USR0043,778,Wildly party lastly whereas yearly.
ART0026,USR0011,779,Near slap I enthusiastically from.
ART0026,USR0047,780,Pancake i.e. those me yikes.
ART0027,USR0047,781,Up inquiring laugh Honduran cry.
ART0027,USR0021,782,Generation which wade enormously who.
ART0027,USR0005,783,Hmm generosity alternatively might why.
ART0027,USR0026,784,Normally his such I thing.
ART0027,USR0027,785,For down bless everybody these.
ART0027,USR0036,786,Group yesterday last creepy whichever.
ART0027,USR0035,787,On part his him an.
ART0027,USR0002,788,Chinese towards outcome besides thoroughly.
ART0027,USR0035,789,Them range down next yourself.
ART0027,USR0045,790,Clump does without oops eventually.
ART0027,USR0036,791,Trust swallow any an just.
ART0027,USR0030,792,To monthly might both her.
ART0027,USR0008,793,His hundreds (space) each being.
ART0027,USR0026,794,Only earlier of I hers.
ART0027,USR0019,795,Chaise snarl party seldom certain.
ART0027,USR0021,796,Woman whom staff whatever both.
ART0027,USR0002,797,Summation with dangerous leap work.
ART0027,USR0004,798,Off anyway though slavery day.
ART0027,USR0018,799,Less was formerly collection jump.
ART0027,USR0017,800,His hair under which yourself.
ART0027,USR0007,801,Yearly Polish between he to.
ART0027,USR0018,802,Have these next these those.
ART0027,USR0003,803,Mine give give result bowl.
ART0027,USR0049,804,Whom stupidity child consequently labour.
ART0027,USR0040,805,Did person thoroughly someone work.
ART0027,USR0032,806,Can him choir where due.
ART0027,USR0021,807,Air galaxy of machine slavery.
ART0027,USR0006,808,Address problem at brace in.
ART0027,USR0014,809,Include ourselves besides be Belgian.
ART0027,USR0042,810,Here by that noisily these.
ART0028,USR0010,811,Next awareness been sternly am.
ART0028,USR0037,812,Alternatively ourselves these eye within.
ART0028,USR0037,813,Those tonight tomorrow ouch cry.
ART0028,USR0036,814,Lastly forest in number that.
ART0028,USR0032,815,Bravo might can eye lastly.
ART0028,USR0013,816,End soon problem he swim.
ART0028,USR0007,817,Place when each anywhere besides.
ART0028,USR0019,818,Were could then riches our.
ART0028,USR0029,819,Apple ours danger select fortnightly.
ART0028,USR0013,820,Until somebody enough in do.
ART0028,USR0033,821,For backwards member usually later.
ART0028,USR0007,822,Bed wake group an appetite.
ART0028,USR0012,823,Tomorrow fact theirs those besides.
ART0028,USR0023,824,For throughout eye where this.
ART0028,USR0030,825,Which intensely stand tame they.
ART0028,USR0024,826,My late about scary sometimes.
ART0028,USR0029,827,Keep party do which her.
ART0028,USR0023,828,For my whereas troop building.
ART0028,USR0015,829,Chapter you in greatly much.
ART0028,USR0008,830,Softly wander are one any.
ART0028,USR0045,831,Which might theirs this turkey.
ART0028,USR0015,832,Then does of now me.
ART0028,USR0019,833,By dog annually week as.
ART0028,USR0014,834,That as finally herself success.
ART0028,USR0032,835,As theirs watch block now.
ART0028,USR0037,836,Monthly oops usually intelligence behind.
ART0028,USR0018,837,These Swiss it its but.
ART0028,USR0013,838,Example where climb murder when.
ART0028,USR0039,839,Was pout theirs can never.
ART0028,USR0012,840,Outcome school cash pray growth.
ART0029,USR0006,841,Finally win bravo so of.
ART0029,USR0036,842,Very well their why frequently.
ART0029,USR0012,843,Previously finally itself soap there.
ART0029,USR0023,844,When Atlantic what why pink.
ART0029,USR0005,845,Whale be this bravo bread.
ART0029,USR0018,846,Finally we soon slavery us.
ART0029,USR0036,847,Those gee must Kazakh a.
ART0029,USR0028,848,Archipelago since galaxy with many.
ART0029,USR0037,849,Who whose their it certain.
ART0029,USR0046,850,Dangerous aha must our these.
ART0029,USR0007,851,Early pack each Burkinese firstly.
ART0029,USR0017,852,Importance are then for repulsive.
ART0029,USR0014,853,Instead of hence newspaper does.
ART0029,USR0031,854,Gloves where idea formerly block.
ART0029,USR0038,855,Alas somebody too unless time.
ART0029,USR0003,856,Film whom abroad us there.
ART0029,USR0050,857,Should it his indeed fully.
ART0029,USR0036,858,It why courageously he yet.
ART0029,USR0042,859,Would i.e. disregard proud throughout.
ART0029,USR0021,860,Clock bored from company posse.
ART0029,USR0033,861,Of into deeply it here.
ART0029,USR0022,862,As soon you scold laughter.
ART0029,USR0035,863,Sail its inside these her.
ART0029,USR0048,864,Sunshine involve catalog today it.
ART0029,USR0007,865,Down mine spin shall hundred.
ART0029,USR0035,866,Beneath these elsewhere nightly mustering.
ART0029,USR0033,867,Whose one why greatly knightly.
ART0029,USR0025,868,Am she sometimes while regularly.
ART0029,USR0038,869,Account out read humour for.
ART0029,USR0015,870,Out say our whose absolutely.
ART0030,USR0006,871,Every mustering myself monthly limp.
ART0030,USR0030,872,Certain pack always let sail.
ART0030,USR0012,873,The irritation otherwise day seldom.
ART0030,USR0050,874,Upon aunt I light involve.
ART0030,USR0027,875,Peace to who everyone justice.
ART0030,USR0045,876,Kyrgyz Brazilian what in without.
ART0030,USR0007,877,Not my each sometimes of.
ART0030,USR0030,878,Whirl therefore rudely to elegantly.
ART0030,USR0046,879,Nightly his explode yikes e.g..
ART0030,USR0038,880,Its were Slovak daily our.
ART0030,USR0034,881,Anyone ship must whose that.
ART0030,USR0017,882,Firstly on shall at yesterday.
ART0030,USR0034,883,Did I it keep brace.
ART0030,USR0001,884,Party till ourselves all knock.
ART0030,USR0037,885,Few inside bouquet Himalayan to.
ART0030,USR0030,886,Jealousy anywhere content finally daily.
ART0030,USR0038,887,An where sew today posse.
ART0030,USR0036,888,Dull their here religion which.
ART0030,USR0027,889,Of but consequently i.e. tunnel.
ART0030,USR0034,890,Scold up thing purchase accordingly.
ART0030,USR0020,891,Wade to everyone decidedly e.g..
ART0030,USR0043,892,You down but should ours.
ART0030,USR0011,893,Sing there there their there.
ART0030,USR0020,894,Thing yours this neither this.
ART0030,USR0014,895,E.g. whomever float silently cast.
ART0030,USR0002,896,Must shyly hand whole may.
ART0030,USR0026,897,On cloud aunt several in.
ART0030,USR0035,898,Above which wait though beneath.
ART0030,USR0001,899,Theirs her this herself result.
ART0030,USR0030,900,Often that have rather somewhat.
ART0031,USR0029,901,Earlier you Bahamian stand yours.
ART0031,USR0024,902,How seldom are Polish heart.
ART0031,USR0012,903,Place hundred include that too.
ART0031,USR0045,904,Other teacher laugh brush of.
ART0031,USR0015,905,Which these later next paint.
ART0031,USR0006,906,Stack to that because Mozartian.
ART0031,USR0014,907,Has great scary for vomit.
ART0031,USR0020,908,Us staff awareness way ostrich.
ART0031,USR0024,909,Out himself yoga those him.
ART0031,USR0031,910,Who his most mine publicity.
ART0031,USR0013,911,One horde practically as could.
ART0031,USR0010,912,Thing her grip light monthly.
ART0031,USR0030,913,Neither fortnightly theirs entertainment hmm.
ART0031,USR0005,914,Him deceive his with onion.
ART0031,USR0047,915,That secondly these jersey at.
ART0031,USR0032,916,Week being fork what just.
ART0031,USR0031,917,What magazine mine envy those.
ART0031,USR0004,918,Aha substantial these her seldom.
ART0031,USR0023,919,You nevertheless part then its.
ART0031,USR0048,920,Of annually formerly away why.
ART0031,USR0020,921,In ream for whose we.
ART0031,USR0043,922,Otherwise first these nest mine.
ART0031,USR0025,923,Quarterly cast pack nobody quiver.
ART0031,USR0049,924,These were in over jewelry.
ART0031,USR0048,925,Body part quantity to could.
ART0031,USR0006,926,Employment exemplified usually however moreover.
ART0031,USR0010,927,Till on whom confusing from.
ART0031,USR0016,928,Somali in fortnightly scary secondly.
ART0031,USR0036,929,Monthly confusing that yourselves melt.
ART0031,USR0040,930,Infrequently but how yourselves several.
ART0032,USR0048,931,Soon government anyway pack several.
ART0032,USR0041,932,Indeed pod group lastly surgeon.
ART0032,USR0021,933,Around nearly yesterday recently how.
ART0032,USR0040,934,Including those it British last.
ART0032,USR0041,935,Quarterly scenic band alternatively how.
ART0032,USR0031,936,Somebody today that who government.
ART0032,USR0036,937,Whose that humour importance lot.
ART0032,USR0040,938,Till heavily to fire these.
ART0032,USR0027,939,It few our band clap.
ART0032,USR0039,940,Your did respects poverty where.
ART0032,USR0027,941,Next are another infrequently nest.
ART0032,USR0008,942,Write fight pierce who path.
ART0032,USR0021,943,Welfare then here when daughter.
ART0032,USR0050,944,Fascinate foolishly then which since.
ART0032,USR0024,945,Whatever hand that boat those.
ART0032,USR0009,946,Before trade watch usually crowd.
ART0032,USR0044,947,Any dark how in secondly.
ART0032,USR0050,948,Us cook many where next.
ART0032,USR0012,949,Its since respect success first.
ART0032,USR0001,950,Firstly there how company today.
ART0032,USR0030,951,Dig yay to have his.
ART0032,USR0010,952,Iranian day calmly cloud fact.
ART0032,USR0027,953,Soon they every though yourself.
ART0032,USR0007,954,Outfit year collection somebody ours.
ART0032,USR0006,955,Eek it collection words he.
ART0032,USR0022,956,From out soften either for.
ART0032,USR0045,957,That often as due staff.
ART0032,USR0021,958,Then limp tomorrow work for.
ART0032,USR0018,959,Up firstly Jungian army that.
ART0032,USR0033,960,Same patrol fight in sadly.
ART0033,USR0037,961,Inside she mysteriously host tomorrow.
ART0033,USR0012,962,Noise as then collection shake.
ART0033,USR0050,963,These consequence wings pack on.
ART0033,USR0007,964,Them bunch caravan early those.
ART0033,USR0013,965,Bow yesterday neither her us.
ART0033,USR0035,966,Yesterday aid fortnightly was yesterday.
ART0033,USR0001,967,Someone yourselves wad since this.
ART0033,USR0028,968,Stack weekly myself whom who.
ART0033,USR0011,969,However whom gleaming caravan everyone.
ART0033,USR0046,970,Hers few quit that each.
ART0033,USR0048,971,Firstly occasionally may why before.
ART0033,USR0044,972,Vietnamese formerly from group yet.
ART0033,USR0026,973,As poor where terribly still.
ART0033,USR0020,974,Tunnel whose some case turn.
ART0033,USR0042,975,Ourselves that might anywhere caravan.
ART0033,USR0001,976,Myself how run what shower.
ART0033,USR0002,977,Eventually alternatively for be could.
ART0033,USR0029,978,Finnish seldom did tonight Alaskan.
ART0033,USR0039,979,Must this bale now enormously.
ART0033,USR0039,980,Laugh weekly there while then.
ART0033,USR0016,981,Riches which laugh coat luxury.
ART0033,USR0042,982,Through speedily sandals gee might.
ART0033,USR0032,983,To this bale poverty while.
ART0033,USR0007,984,His owing employment day remind.
ART0033,USR0042,985,Which foot in hedge with.
ART0033,USR0045,986,For bravo sometimes speedily so.
ART0033,USR0048,987,With Mozartian sedge gleaming of.
ART0033,USR0036,988,When knightly occur up whatever.
ART0033,USR0046,989,Should everyone some for is.
ART0033,USR0017,990,Later staff her their backwards.
