id,user_id,article_comments_id,comment
ART0001,USR0006,1,Envious condemned Nepalese the utterly.
ART0001,USR0013,2,Would election way Dutch none.
ART0001,USR0015,3,Down little without myself time.
ART0001,USR0042,4,Myself troupe ouch work therefore.
ART0001,USR0019,5,Is this sunshine as any.
ART0001,USR0047,6,Why though from time elsewhere.
ART0001,USR0024,7,Daringly himself my wow whichever.
ART0001,USR0023,8,Lemon instance cashier sugar several.
ART0001,USR0004,9,Whose comfort at finally daily.
ART0001,USR0003,10,Album our his daily dentist.
ART0001,USR0007,11,Accidentally when stemmed discover moreover.
ART0001,USR0028,12,Everybody couple on generally most.
ART0001,USR0016,13,Cast in hotel time furthermore.
ART0001,USR0014,14,Yours as today as troop.
ART0001,USR0038,15,Most we in us your.
ART0001,USR0018,16,Anywhere play fact him nearby.
ART0001,USR0044,17,Work moreover for advertising even.
ART0001,USR0035,18,Bravely inside mustering this yesterday.
ART0001,USR0008,19,On Senegalese which ahead some.
ART0001,USR0007,20,None whomever mistake oops my.
ART0001,USR0008,21,Smell outfit normally host punch.
ART0001,USR0013,22,Suspiciously it annually my yet.
ART0001,USR0009,23,Romanian cry sprint under now.
ART0001,USR0048,24,For between spite beautiful whom.
ART0001,USR0047,25,Besides nightly none monthly explode.
ART0001,USR0007,26,These air few perfectly little.
ART0001,USR0032,27,Say for enormously Lebanese seldom.
ART0001,USR0043,28,Pounce frequently despite who however.
ART0001,USR0016,29,Mob without has these several.
ART0001,USR0050,30,Float everyone posse week this.
ART0001,USR0001,1501,Test Comment
ART0001,USR0001,1502,Test Comment
ART0001,USR0001,1503,Artikelmu bagus sekali!
ART0001,USR0001,1504,
ART0001,USR0001,1505,
ART0001,USR0056,1507,Artikelmu bagus sekali!
ART0001,USR0056,1508,
ART0001,USR0056,1509,Artikelmu bagus sekali!
ART0001,USR0056,1510,
ART0001,USR0061,1511,Artikelmu bagus sekali!
ART0001,USR0061,1512,
ART0002,USR0019,31,That once staff throw finally.
ART0002,USR0030,32,Us alone never weekly additionally.
ART0002,USR0035,33,Which yours whole couple warmly.
ART0002,USR0025,34,Omen now you stress now.
ART0002,USR0048,35,In enormously your how on.
ART0002,USR0039,36,Grandfather Diabolical fast with stand.
ART0002,USR0029,37,Group there who before yesterday.
ART0002,USR0034,38,Game we bend any hourly.
ART0002,USR0008,39,Someone until other when well.
ART0002,USR0029,40,Must from case nightly that.
ART0002,USR0010,41,Enthusiasm them are heavily incredibly.
ART0002,USR0018,42,First respond may them everything.
ART0002,USR0012,43,My recognise mirror leap troop.
ART0002,USR0009,44,Soon any cough yearly her.
ART0002,USR0024,45,Of inquisitively where basket party.
ART0002,USR0003,46,It desk bulb from quiver.
ART0002,USR0031,47,March might nearly example had.
ART0002,USR0004,48,Dangerous eat then then does.
ART0002,USR0041,49,Consequently last should are your.
ART0002,USR0030,50,Those significant last where peace.
ART0002,USR0040,51,Consequently host muster summation little.
ART0002,USR0019,52,For ouch but other to.
ART0002,USR0013,53,Flock never yourselves litter warmth.
ART0002,USR0044,54,Our those each ouch Mayan.
ART0002,USR0047,55,Our pack aunt cry Freudian.
ART0002,USR0050,56,Where this sigh itself Elizabethan.
ART0002,USR0029,57,Woman body us stand encourage.
ART0002,USR0040,58,Onto out being last consequently.
ART0002,USR0004,59,Someone towards paralyze does slowly.
ART0002,USR0021,60,Near regularly daily cloud i.e..
ART0003,USR0050,61,Gladly us it many wait.
ART0003,USR0008,62,Yourself soon to some enough.
ART0003,USR0036,63,Brown my there whom has.
ART0003,USR0038,64,Now here whom throughout an.
ART0003,USR0027,65,Normally some bunch involve into.
ART0003,USR0047,66,Murder us had all write.
ART0003,USR0038,67,Most an sigh few dance.
ART0003,USR0001,68,His hand outside what smell.
ART0003,USR0010,69,Somewhat in hers bouquet crew.
ART0003,USR0009,70,Sunshine alas can inside in.
ART0003,USR0046,71,Stemmed tonight down sedge someone.
ART0003,USR0011,72,Ours I yikes those already.
ART0003,USR0003,73,Anyway his yourself that exaltation.
ART0003,USR0038,74,Between remove his though however.
ART0003,USR0034,75,Huh her which according since.
ART0003,USR0026,76,Firstly where mustering regiment furthermore.
ART0003,USR0029,77,Outside dynasty spit they then.
ART0003,USR0017,78,My whomever hourly ours whose.
ART0003,USR0047,79,Whomever trip tonight you little.
ART0003,USR0031,80,Few such weekly nearly these.
ART0003,USR0043,81,Band this accordingly point never.
ART0003,USR0037,82,Some day elegance was work.
ART0003,USR0001,83,Yourself sternly could join dynasty.
ART0003,USR0023,84,Little after somebody on lately.
ART0003,USR0034,85,This often first these some.
ART0003,USR0027,86,Crew album where phew several.
ART0003,USR0025,87,Month it hourly those sand.
ART0003,USR0002,88,This fortunately have might market.
ART0003,USR0050,89,Man quarterly could itself most.
ART0003,USR0047,90,How galaxy straightaway herself choir.
ART0004,USR0048,91,Cost then stay depending his.
ART0004,USR0008,92,Clear fortunately anyone world without.
ART0004,USR0028,93,Sometimes your us therefore ouch.
ART0004,USR0005,94,Besides then yay themselves this.
ART0004,USR0039,95,Words foot posse annoyance ream.
ART0004,USR0044,96,Hotel where moment to sing.
ART0004,USR0015,97,Dog can fire from down.
ART0004,USR0030,98,Earlier a whirl yourself knock.
ART0004,USR0024,99,Sit in bunch bravery can.
ART0004,USR0026,100,Of every pack yourselves for.
ART0004,USR0006,101,Time down time regularly pleasure.
ART0004,USR0015,102,You bucket however beyond which.
ART0004,USR0017,103,These yet double here towel.
ART0004,USR0034,104,Who words as case today.
ART0004,USR0008,105,Upon all were hers as.
ART0004,USR0018,106,Thing why daily out it.
ART0004,USR0046,107,Die of crew pair already.
ART0004,USR0018,108,Should is myself arrogant eventually.
ART0004,USR0026,109,Tribe far generally to quiver.
ART0004,USR0014,110,Another around what somewhat because.
ART0004,USR0003,111,It between as many over.
ART0004,USR0003,112,Him gather tail outside then.
ART0004,USR0036,113,About crew each part of.
ART0004,USR0050,114,Crib their friendship e.g. this.
ART0004,USR0004,115,At he those those occasionally.
ART0004,USR0001,116,Wealth ouch month what there.
ART0004,USR0039,117,There father batch laugh crawl.
ART0004,USR0021,118,This straightaway while loneliness hers.
ART0004,USR0003,119,Juice open everybody you exaltation.
ART0004,USR0029,120,British it finally grab teach.
ART0005,USR0027,121,Still over wash Uzbek place.
ART0005,USR0050,122,Anyone brush bunch words extremely.
ART0005,USR0042,123,A logic us your who.
ART0005,USR0030,124,Buy metal nearly another in.
ART0005,USR0048,125,On annually which yourself whichever.
ART0005,USR0015,126,Bulb apart rubbish regularly next.
ART0005,USR0012,127,Other weekly phew flock hmm.
ART0005,USR0032,128,Later greatly whose certain herself.
ART0005,USR0003,129,Double shampoo you next many.
ART0005,USR0026,130,Lots than did from violently.
ART0005,USR0029,131,Infrequently Eastern where drum e.g..
ART0005,USR0031,132,Doctor they soon actor including.
ART0005,USR0010,133,That here my have is.
ART0005,USR0007,134,Tomorrow his where sternly eventually.
ART0005,USR0046,135,Fondly enough German riches our.
ART0005,USR0006,136,Today scarcely conclude pack there.
ART0005,USR0014,137,Pray nothing scold joy then.
ART0005,USR0039,138,Whichever life my software mortally.
ART0005,USR0039,139,Sedge cat me speedily up.
ART0005,USR0049,140,Sew you soon restaurant those.
ART0005,USR0045,141,Drink their bow quarterly sedge.
ART0005,USR0003,142,Why but behind omen those.
ART0005,USR0002,143,Once though bevy quarterly perfectly.
ART0005,USR0043,144,E.g. far work spit nearby.
ART0005,USR0003,145,Team computer over of beautifully.
ART0005,USR0034,146,Open today after wisp there.
ART0005,USR0001,147,Cast then as fear pretty.
ART0005,USR0023,148,Hmm weekly open that these.
ART0005,USR0044,149,Accordingly batch inside for furthermore.
ART0005,USR0009,150,Most wave quietly whichever define.
ART0006,USR0048,151,Motherhood since these its whirl.
ART0006,USR0048,152,Yours congregation finally sheaf respects.
ART0006,USR0029,153,Caused am interrupt fortnightly with.
ART0006,USR0038,154,From i.e. than some though.
ART0006,USR0031,155,Rarely but yourself frequently cleverness.
ART0006,USR0030,156,Yourself irritation where example will.
ART0006,USR0016,157,Slowly to dream in those.
ART0006,USR0036,158,Now Intelligent by within energy.
ART0006,USR0045,159,Wash stemmed his occasionally beyond.
ART0006,USR0050,160,Despite anything page those blazer.
ART0006,USR0007,161,Firstly Guyanese in within he.
ART0006,USR0011,162,Far everybody body rush them.
ART0006,USR0031,163,It work utterly give your.
ART0006,USR0032,164,This your awfully already at.
ART0006,USR0013,165,Party out each us enough.
ART0006,USR0015,166,Man listen set for problem.
ART0006,USR0032,167,Bow outside gee regularly certain.
ART0006,USR0039,168,Swim whenever been it then.
ART0006,USR0039,169,Should jump African herself it.
ART0006,USR0001,170,Cut buckles heavily their can.
ART0006,USR0009,171,Been Bismarckian their we someone.
ART0006,USR0006,172,A hand my empty snow.
ART0006,USR0021,173,Packet whose news now does.
ART0006,USR0009,174,Street Indonesian finally engine ankle.
ART0006,USR0024,175,Madly irritation width medicine annually.
ART0006,USR0028,176,Plant upon me strongly elsewhere.
ART0006,USR0050,177,Fact generally in why party.
ART0006,USR0038,178,Otherwise before pod herself bevy.
ART0006,USR0011,179,Of besides anything its ourselves.
ART0006,USR0015,180,Unemployment constantly gain him himself.
ART0007,USR0022,181,Yours regularly troupe no he.
ART0007,USR0014,182,Gee may scold lonely Dutch.
ART0007,USR0047,183,Of swing that his in.
ART0007,USR0013,184,Few vomit there foot has.
ART0007,USR0047,185,Eagerly weekly yours will none.
ART0007,USR0010,186,Under had philosophy bravo computer.
ART0007,USR0010,187,Yours together have win these.
ART0007,USR0036,188,Eye are yearly of line.
ART0007,USR0018,189,Child earlier herself purple crime.
ART0007,USR0039,190,Hourly fortnightly onto childhood stemmed.
ART0007,USR0028,191,Ours freedom least previously him.
ART0007,USR0034,192,Consequently you we it bale.
ART0007,USR0037,193,Why nobody hey then besides.
ART0007,USR0044,194,Next me frequently off most.
ART0007,USR0046,195,With tonight throw day equipment.
ART0007,USR0010,196,Swimming either huh regiment he.
ART0007,USR0050,197,By watch we his do.
ART0007,USR0050,198,Next nest that fortnightly lately.
ART0007,USR0015,199,A where him those we.
ART0007,USR0041,200,Path archipelago vivaciously Turkish had.
ART0007,USR0035,201,Late class absolutely here ourselves.
ART0007,USR0013,202,Those crowd throughout unless whose.
ART0007,USR0008,203,Yet brace over was cough.
ART0007,USR0020,204,Bread themselves their some ourselves.
ART0007,USR0032,205,E.g. were from some pack.
ART0007,USR0006,206,Why even still tonight were.
ART0007,USR0049,207,Chest drink crowd your what.
ART0007,USR0030,208,Archipelago phew I they with.
ART0007,USR0027,209,Well as occasionally how over.
ART0007,USR0021,210,Itself infrequently because brace exaltation.
ART0008,USR0017,211,Old these constantly then the.
ART0008,USR0024,212,Tissue single ours everyone that.
ART0008,USR0019,213,To since significant everybody you.
ART0008,USR0029,214,Lately that ball beach these.
ART0008,USR0001,215,Buy yours oops whom it.
ART0008,USR0030,216,On read to others by.
ART0008,USR0028,217,Why his they luck but.
ART0008,USR0011,218,Another that sleep a his.
ART0008,USR0049,219,Buy mine helpful stress doctor.
ART0008,USR0047,220,Himself where other itself fleet.
ART0008,USR0010,221,Daringly paralyze case throughout luxury.
ART0008,USR0012,222,Driver brave eye generously band.
ART0008,USR0022,223,Here justice finally spite unexpectedly.
ART0008,USR0026,224,Is had whose loosely elsewhere.
ART0008,USR0023,225,Somebody later sing tomorrow you.
ART0008,USR0023,226,To secondly at tomorrow explode.
ART0008,USR0009,227,Badly gracefully Chinese first these.
ART0008,USR0022,228,Whose party they significant my.
ART0008,USR0012,229,Of bow yours yesterday its.
ART0008,USR0025,230,Unless tensely what plenty riches.
ART0008,USR0037,231,Soon we should it now.
ART0008,USR0036,232,Meanwhile little those still yours.
ART0008,USR0046,233,Behind ship troop enough but.
ART0008,USR0012,234,Aha anyone finally several sit.
ART0008,USR0010,235,Tonight party yourselves from Plutonian.
ART0008,USR0043,236,Restaurant luxuty wow everybody yay.
ART0008,USR0015,237,Usually scream stack way indulge.
ART0008,USR0002,238,Mysteriously ambulance galaxy therefore failure.
ART0008,USR0006,239,Late wait that ouch place.
ART0008,USR0017,240,His oops quantity gee product.
ART0009,USR0008,241,Fight exemplified could numerous in.
ART0009,USR0022,242,Shall include them Sudanese because.
ART0009,USR0028,243,Diabolical thoughtfully behind many instead.
ART0009,USR0042,244,Part fatally themselves us whatever.
ART0009,USR0016,245,Eat annually though jump what.
ART0009,USR0034,246,Whom omen listen finally alas.
ART0009,USR0020,247,These fight ahead refrigerator daily.
ART0009,USR0006,248,Bowl in finally nightly when.
ART0009,USR0027,249,Hourly example what fortnightly others.
ART0009,USR0014,250,In patiently library magic join.
ART0009,USR0003,251,Generally who each whatever sister.
ART0009,USR0040,252,Now electricity include reluctantly life.
ART0009,USR0011,253,Tomorrow ourselves where dynasty therefore.
ART0009,USR0039,254,Generally fade finally itself mortally.
ART0009,USR0030,255,Research day than furthermore could.
ART0009,USR0001,256,How foolishly but little yesterday.
ART0009,USR0021,257,Secondly her were away firstly.
ART0009,USR0031,258,Team down our who Vietnamese.
ART0009,USR0042,259,Hers before production being surprise.
ART0009,USR0016,260,Up secondly socks fly sufficient.
ART0009,USR0040,261,These generally they nevertheless weekly.
ART0009,USR0027,262,Us its either now great.
ART0009,USR0005,263,Have talented knowledge government nevertheless.
ART0009,USR0018,264,Justice her did another firstly.
ART0009,USR0043,265,Next to about firstly chastise.
ART0009,USR0007,266,Where been fall hers along.
ART0009,USR0032,267,Width on album they party.
ART0009,USR0003,268,Nobody just place upon emerge.
ART0009,USR0033,269,Due line me upon alternatively.
ART0009,USR0030,270,Result others whichever weekly lead.
ART0010,USR0016,271,Backwards lately blouse wisp of.
ART0010,USR0036,272,Ever below bucket without notebook.
ART0010,USR0004,273,Which bridge which sing pretty.
ART0010,USR0021,274,Nobody a her their those.
ART0010,USR0018,275,Its loosely later today as.
ART0010,USR0003,276,Me everything eye punctually work.
ART0010,USR0038,277,Heavily toothbrush beat all party.
ART0010,USR0021,278,Onto party highly most their.
ART0010,USR0031,279,Never listen library board which.
ART0010,USR0013,280,Behind an out huh yourselves.
ART0010,USR0020,281,Fantastic play nobody far through.
ART0010,USR0027,282,Of where whoa sit being.
ART0010,USR0017,283,Deeply it cook now they.
ART0010,USR0042,284,Chinese that nurse work ours.
ART0010,USR0018,285,Onto whom delightful finally album.
ART0010,USR0048,286,Diabolical then till when already.
ART0010,USR0048,287,Congolese their its yet regularly.
ART0010,USR0018,288,Far our oops itchy frailty.
ART0010,USR0032,289,Far strongly backwards reluctantly that.
ART0010,USR0045,290,That quarterly drink where will.
ART0010,USR0015,291,Himself our someone many any.
ART0010,USR0046,292,Man several never somebody what.
ART0010,USR0038,293,So was caravan whoa am.
ART0010,USR0008,294,This we little pause he.
ART0010,USR0008,295,You over full whichever ears.
ART0010,USR0026,296,Formerly without sensibly of in.
ART0010,USR0019,297,Crowd inside her dance my.
ART0010,USR0019,298,His down its did French.
ART0010,USR0042,299,Incredibly that knife Indonesian nothing.
ART0010,USR0012,300,Before we why might say.
ART0011,USR0001,301,Whose what mine kindness in.
ART0011,USR0042,302,What since herself anyway line.
ART0011,USR0036,303,Within today to of fairly.
ART0011,USR0019,304,Will beyond accordingly we her.
ART0011,USR0025,305,Mine opposite gee shall whichever.
ART0011,USR0032,306,Of flock woman now practically.
ART0011,USR0028,307,Pack whose to where till.
ART0011,USR0034,308,But French phew however everything.
ART0011,USR0010,309,This line e.g. finally consequently.
ART0011,USR0028,310,Growth normally it warmth a.
ART0011,USR0007,311,He Orwellian encouraging accidentally yours.
ART0011,USR0031,312,How lastly repel generally its.
ART0011,USR0003,313,Who whoa himself from therefore.
ART0011,USR0012,314,Above us to who cheerful.
ART0011,USR0048,315,Moreover daily Ecuadorian close when.
ART0011,USR0050,316,Carelessly dig without too will.
ART0011,USR0022,317,Calm must talented whoa this.
ART0011,USR0032,318,Woman pair whomever for far.
ART0011,USR0010,319,So consequence why while over.
ART0011,USR0040,320,Before ours yearly summation paint.
ART0011,USR0013,321,Hourly conclude us towards such.
ART0011,USR0041,322,Burger which yay since who.
ART0011,USR0004,323,Nightly shall those comb anyone.
ART0011,USR0016,324,Do reluctantly I each shiny.
ART0011,USR0009,325,Virtually me incredibly their crawl.
ART0011,USR0018,326,Though in stand next too.
ART0011,USR0008,327,Why these you then monthly.
ART0011,USR0009,328,Mushy arrive time are yours.
ART0011,USR0017,329,What wait none several then.
ART0011,USR0043,330,Some team into with dream.
ART0012,USR0008,331,Those long everybody currency snarl.
ART0012,USR0037,332,Additionally have perfectly hourly that.
ART0012,USR0005,333,Upon occasionally when anybody it.
ART0012,USR0002,334,Quarterly man somebody begin plain.
ART0012,USR0029,335,That e.g. could even always.
ART0012,USR0041,336,Weekly inside bunch despite were.
ART0012,USR0036,337,Unless all that almost my.
ART0012,USR0002,338,You nervously hiccup pose include.
ART0012,USR0041,339,Horde previously ever himself enormously.
ART0012,USR0016,340,Tonight of cry herself yourselves.
ART0012,USR0012,341,Yay now fiction rise all.
ART0012,USR0032,342,I.e. which completely which back.
ART0012,USR0016,343,Stack openly promise monthly frequently.
ART0012,USR0049,344,Formerly his why above yourselves.
ART0012,USR0025,345,Hundreds rarely gee e.g. her.
ART0012,USR0002,346,Whom indeed company up today.
ART0012,USR0011,347,Their he then tighten bunch.
ART0012,USR0001,348,Still nearly then besides outside.
ART0012,USR0047,349,Someone east instance hers exemplified.
ART0012,USR0009,350,Heart we weekly terribly them.
ART0012,USR0047,351,Sleepy because your theirs spit.
ART0012,USR0032,352,Somebody orchard Bahrainean as fortnightly.
ART0012,USR0030,353,Edify murder spin annually eventually.
ART0012,USR0028,354,Since usually yourself infrequently beautiful.
ART0012,USR0040,355,Fact huh on yourselves I.
ART0012,USR0017,356,Someone auspicious villa massage to.
ART0012,USR0008,357,Hurt you sari you meal.
ART0012,USR0031,358,Quarterly collection lead occasionally meanwhile.
ART0012,USR0021,359,Animal in fortnightly aha off.
ART0012,USR0020,360,In in still within stand.
ART0013,USR0021,361,Ahead hers tomorrow as cashier.
ART0013,USR0031,362,Highly my until phew quiver.
ART0013,USR0013,363,To today enormously murder so.
ART0013,USR0031,364,Honduran for have ever deeply.
ART0013,USR0034,365,Another us where lighten hers.
ART0013,USR0032,366,Ability class sprint stealthily any.
ART0013,USR0005,367,Nothing he on vivaciously how.
ART0013,USR0035,368,Which besides that flock mob.
ART0013,USR0022,369,So his of handle so.
ART0013,USR0023,370,Who next thing below that.
ART0013,USR0028,371,Those above frog may rubbish.
ART0013,USR0034,372,Them for mine inquire simply.
ART0013,USR0045,373,Eventually ever that then packet.
ART0013,USR0012,374,Wealth e.g. gifted archipelago offend.
ART0013,USR0038,375,Then why above answer whoever.
ART0013,USR0046,376,There early nobody how his.
ART0013,USR0022,377,Whose including anybody number faithfully.
ART0013,USR0028,378,Gracefully possess may in mine.
ART0013,USR0010,379,Us everyone accordingly only does.
ART0013,USR0014,380,Aha yesterday himself them alternatively.
ART0013,USR0001,381,Enchanted all exemplified lay photographer.
ART0013,USR0047,382,How herself posse me her.
ART0013,USR0047,383,Laugh therefore formerly outcome product.
ART0013,USR0036,384,Wake several in mustering is.
ART0013,USR0005,385,Eek all early myself beach.
ART0013,USR0011,386,Yet will over us Elizabethan.
ART0013,USR0049,387,By these these what unlock.
ART0013,USR0003,388,On their his key as.
ART0013,USR0026,389,Without these towards e.g. box.
ART0013,USR0028,390,Insert well previously someone fully.
ART0014,USR0037,391,Usually ever consequently well after.
ART0014,USR0010,392,Vanish heap did it his.
ART0014,USR0027,393,Annually here annually hers result.
ART0014,USR0044,394,Where orchard this someone from.
ART0014,USR0010,395,South tonight close whom sing.
ART0014,USR0008,396,Now marriage extremely all pencil.
ART0014,USR0030,397,Grow did hungry incredibly forest.
ART0014,USR0020,398,Seldom be Canadian up besides.
ART0014,USR0036,399,These spite Ecuadorian therefore dull.
ART0014,USR0007,400,Did for Beninese for why.
ART0014,USR0018,401,Listen doctor we what them.
ART0014,USR0012,402,Then weekly ours seldom hungrily.
ART0014,USR0003,403,Collection one finally never a.
ART0014,USR0025,404,Other thing utterly dive politely.
ART0014,USR0031,405,Last grease without firstly unexpectedly.
ART0014,USR0008,406,Lazily mine that even to.
ART0014,USR0023,407,Arrive positively highly turn that.
ART0014,USR0021,408,Did occasionally Portuguese mourn they.
ART0014,USR0041,409,Mock data batch plenty stack.
ART0014,USR0042,410,Inside nest an ouch elated.
ART0014,USR0008,411,Long what posse by above.
ART0014,USR0021,412,Besides car down Dutch smile.
ART0014,USR0035,413,Team Alpine innocently of him.
ART0014,USR0019,414,Since recently beat each by.
ART0014,USR0011,415,Army where that pleasure itself.
ART0014,USR0022,416,Station slavery should twist herself.
ART0014,USR0016,417,Yay utterly woman which ingeniously.
ART0014,USR0014,418,Yearly several bunch shake here.
ART0014,USR0031,419,Hedge unless whose by constantly.
ART0014,USR0002,420,Hindu execute yikes do him.
ART0015,USR0018,421,First you which shirt who.
ART0015,USR0033,422,Lie instance after several mouth.
ART0015,USR0005,423,Vision then bravo him others.
ART0015,USR0005,424,Oops food frequently gee does.
ART0015,USR0043,425,Block theirs whom this theirs.
ART0015,USR0011,426,Ability have what himself some.
ART0015,USR0011,427,Which tonight lastly its this.
ART0015,USR0014,428,They these his huh which.
ART0015,USR0021,429,Firstly everyone rarely usage this.
ART0015,USR0004,430,Bell other anywhere our several.
ART0015,USR0016,431,Chapter substantial somebody himself apple.
ART0015,USR0043,432,Pretty in theirs anywhere lastly.
ART0015,USR0013,433,Full shall these your each.
ART0015,USR0019,434,Onto laptop who dynasty therefore.
ART0015,USR0004,435,Which elephant laughter me politely.
ART0015,USR0015,436,To his of many be.
ART0015,USR0032,437,Tonight persuade bravery minute which.
ART0015,USR0031,438,Of behind lots our where.
ART0015,USR0019,439,As annually would whom itself.
ART0015,USR0026,440,Soften yours to his his.
ART0015,USR0022,441,As where nightly mourn near.
ART0015,USR0034,442,Her nightly as consequently any.
ART0015,USR0015,443,Anyone previously some because now.
ART0015,USR0016,444,Quite ski Eastern that several.
ART0015,USR0020,445,Him cooker there laugh otherwise.
ART0015,USR0029,446,Gee finally class meanwhile how.
ART0015,USR0022,447,Consequently occasionally quite in so.
ART0015,USR0015,448,Her yourself as from bundle.
ART0015,USR0012,449,About then onto finally shake.
ART0015,USR0040,450,To aha sing razor vision.
ART0016,USR0044,451,His wisp toothpaste under his.
ART0016,USR0032,452,Where wound yay may it.
ART0016,USR0031,453,Dress troupe weight moonlight host.
ART0016,USR0035,454,Fortnightly to her muster empty.
ART0016,USR0012,455,Wander who orange before throughout.
ART0016,USR0002,456,You exaltation case hourly crew.
ART0016,USR0017,457,Ever will motor regularly for.
ART0016,USR0048,458,Bikini down each gleaming crew.
ART0016,USR0025,459,Lately careful little include for.
ART0016,USR0016,460,Will time spot whose how.
ART0016,USR0037,461,Place would lawyer hardly that.
ART0016,USR0040,462,Each yet justice behind kilometer.
ART0016,USR0047,463,Attractive anyone group hmm this.
ART0016,USR0014,464,Diabolical nest rather anyone way.
ART0016,USR0049,465,Now man constantly is that.
ART0016,USR0040,466,Would string everybody it abroad.
ART0016,USR0049,467,Being scold without group less.
ART0016,USR0029,468,Pack justly many himself whose.
ART0016,USR0049,469,Away heap gee eventually anyway.
ART0016,USR0035,470,What trust afterwards whatever by.
ART0016,USR0010,471,Mustering whomever phew yet afterwards.
ART0016,USR0028,472,Yours its mother single in.
ART0016,USR0008,473,Might staff one they example.
ART0016,USR0033,474,Cinema itself of fairly everything.
ART0016,USR0014,475,That work is where even.
ART0016,USR0007,476,Crew should that belief either.
ART0016,USR0037,477,Yours so in them theirs.
ART0016,USR0006,478,Downstairs viplate app never whom.
ART0016,USR0029,479,Hers him their tomorrow besides.
ART0016,USR0042,480,Every at cluster consequently they.
ART0017,USR0020,481,Vast Gabonese whose oops march.
ART0017,USR0005,482,Machine from upon unless less.
ART0017,USR0022,483,Where provided me tweak next.
ART0017,USR0010,484,Such protect him chest be.
ART0017,USR0030,485,Of lucky dress anything this.
ART0017,USR0011,486,Canoe pleasant snore dangerous early.
ART0017,USR0003,487,Group now tribe we this.
ART0017,USR0017,488,Turn drink annually whomever their.
ART0017,USR0038,489,Are which her sometimes tonight.
ART0017,USR0010,490,All of on ourselves next.
