id,user_id,article_comments_id,comment
ART0050,USR0010,1477,Fairly phew it Sammarinese today.
ART0050,USR0027,1478,Out theater lately nobody a.
ART0050,USR0019,1479,Everybody huh after it as.
ART0050,USR0012,1480,Grow any from his sleep.
ART0050,USR0011,1481,Anger whose single any himself.
ART0050,USR0045,1482,Result from hamburger Polish Buddhist.
ART0050,USR0014,1483,Near in anyone many troop.
ART0050,USR0029,1484,Point by whom had may.
ART0050,USR0021,1485,Those awfully punctually our vest.
ART0050,USR0037,1486,Huh his pod that viplate.
ART0050,USR0046,1487,With your I alone i.e..
ART0050,USR0021,1488,Ugly yours by everybody so.
ART0050,USR0022,1489,Several friendship weekly being it.
ART0050,USR0026,1490,Daily alas yay constantly previously.
ART0050,USR0002,1491,Neither whatever bouquet Italian repeatedly.
ART0050,USR0036,1492,At respects gently pain this.
ART0050,USR0041,1493,With it often here annually.
ART0050,USR0035,1494,With yay nearby though wheat.
ART0050,USR0035,1495,Finally one would somebody puzzled.
ART0050,USR0010,1496,Dance Afghan wait reel their.
ART0050,USR0007,1497,Here fact there luxuty quarterly.
ART0050,USR0040,1498,Whom lead toes as this.
ART0050,USR0020,1499,To what regularly all Diabolical.
ART0050,USR0043,1500,An always what rapidly hourly.
