id,title_content,description,created_at,updated_at
1456,Nostrum dolorum in sunt harum fugiat.,Sequi temporibus cupiditate facilis aspernatur cupiditate. Blanditiis minus eum officia odio consectetur veritatis atque. Officia consequatur natus exercitationem quo rem autem.,1998-04-30 09:14:00,1997-05-14 13:00:45
7709,Deleniti veniam sunt placeat.,"Culpa labore in sapiente provident facilis magni minus.
Atque corporis quisquam consequuntur.",1992-11-29 06:55:30,2020-08-31 23:29:01
6357,Accusamus nulla fuga rerum saepe asperiores ratione.,Reprehenderit placeat molestias. Minus voluptatibus dolore eius ea. Veritatis adipisci rerum sed fugit ipsum officiis.,1970-02-21 13:47:11,1986-04-14 05:25:06
1824,Accusamus amet sed impedit tempora libero laborum provident.,Nihil harum ad consequatur at libero ducimus. Harum corporis non aperiam corrupti in. Occaecati vitae ipsa quos incidunt velit.,2018-07-17 22:02:49,1987-06-10 19:52:45
1906,Dolor incidunt ullam possimus laborum occaecati.,Officia a aspernatur quia adipisci ipsum iure. Nesciunt vel odio eveniet voluptates optio voluptatem eveniet. Tempore molestias et cumque enim officia nesciunt quidem.,2009-08-27 19:59:50,2016-08-07 15:17:26
3461,Accusantium maxime in cumque occaecati nemo.,"Placeat dignissimos unde. Neque fugiat quas minus. Animi provident eaque nostrum.
Distinctio nihil quasi sint nesciunt eum incidunt. Nulla ex tenetur. Aliquam soluta nostrum assumenda.",1990-06-18 22:19:50,1993-12-06 17:46:03
9921,Perferendis enim totam ratione pariatur est.,Id veritatis dignissimos corporis exercitationem reiciendis a. Saepe recusandae necessitatibus temporibus modi quos. Natus alias tempore nesciunt ipsa error. Eaque iure aliquid.,1974-12-29 02:28:15,2007-12-03 14:42:00
3079,Cumque eaque laborum veniam est.,Saepe aperiam nesciunt. Placeat quo officia ducimus placeat quasi recusandae. Harum fuga deserunt eos iusto recusandae molestias.,2018-02-10 06:06:33,2007-12-21 18:25:22
6833,Quo fugit quas magni.,"Iste cupiditate deserunt quia. Consequatur repudiandae similique ipsam atque.
Facere fugit vitae molestiae dolorem. Error quidem ducimus sint at voluptatem ab. Nisi amet doloribus deleniti.",2007-06-27 15:28:07,1971-05-06 13:04:15
2086,Praesentium minus qui ab temporibus maxime molestias.,"Doloribus maiores ipsa eum consectetur rem est.
Aut sit quibusdam.
Autem culpa quas sint. Aliquam similique omnis doloribus culpa dolor. Ea facere assumenda quidem necessitatibus illum inventore.",1978-11-27 11:02:13,1996-03-31 04:41:54
9662,Repellat doloremque molestias odio.,"Corrupti alias praesentium repellat inventore magni accusamus.
Unde perspiciatis eius dignissimos est. Nihil tempora porro asperiores earum aliquid.",1983-01-27 01:55:46,2012-06-20 08:44:13
9576,Culpa possimus totam ullam voluptatem.,"Dolores reiciendis vel eos sequi sequi. Voluptatibus odit aliquid autem.
Incidunt placeat fugiat ut assumenda eveniet sint. Suscipit reiciendis nihil harum. Odit quaerat fugiat asperiores.",1984-12-23 16:31:02,2019-08-13 19:42:28
200,Esse tempora itaque itaque at possimus.,"Dolore quidem fuga perspiciatis. Vero dolorem quis dolorum expedita veritatis.
Illum quae quasi voluptatibus adipisci soluta voluptas. Dolorum nam ipsa voluptatum voluptates esse.",1998-03-29 04:37:55,2016-10-23 02:05:30
8176,Cupiditate quibusdam alias necessitatibus amet corrupti.,Voluptatibus labore sequi facilis ea. Voluptas minima quos dicta earum perferendis autem. Pariatur consectetur labore nulla similique. Fugit vitae alias sunt dicta impedit illo.,2011-02-06 04:03:51,1986-06-30 03:41:03
9093,Ea ipsum delectus quaerat.,"Sequi dolore odit libero fuga quos vero. Impedit eum ea dolor.
Iste incidunt adipisci impedit iure. Alias cupiditate inventore sint totam.",2012-12-21 01:14:18,1982-12-26 09:39:18
7515,Et laborum vero ea.,"Optio quia vero sunt sit at mollitia quis. Sunt laborum excepturi. Nostrum sunt dolorem est officiis repellendus.
Ipsum adipisci quos. Voluptatum nam reiciendis aliquam quaerat nisi.",2008-04-17 23:36:37,2003-07-31 09:56:14
630,Cum iusto amet perspiciatis quae est.,"Nam laborum eos accusamus exercitationem.
Perferendis consectetur autem alias ipsam. Iure in in ipsa quam aspernatur vitae.",2014-10-21 08:06:08,1983-04-10 19:11:23
9610,Natus occaecati error beatae quod reprehenderit inventore beatae.,Eius veritatis aut amet minus dicta. Quos facere sint quaerat harum temporibus. Ad nostrum voluptate est officia facilis quas.,2007-11-20 06:05:17,1980-09-13 23:43:06
2342,Enim ratione delectus corporis.,Atque incidunt maxime in numquam. Occaecati excepturi voluptates autem reprehenderit quasi dolores. Architecto nemo doloribus quam a consectetur.,2016-08-12 16:15:30,1995-06-20 08:53:47
6988,Ab porro eligendi amet molestiae.,Aut sequi laudantium tempora iusto quas. Molestiae doloribus ab. Rerum incidunt ducimus alias provident voluptas neque. Suscipit reiciendis autem dicta omnis tenetur autem.,2011-05-27 11:43:26,1975-07-13 15:42:34
6388,Consequuntur necessitatibus totam iusto eius veniam blanditiis.,Laudantium corrupti beatae accusantium doloremque molestiae quod perferendis. A dignissimos doloribus. In odio fuga tempore dolorum.,1974-10-05 21:48:25,1970-09-23 06:43:40
8583,Vitae dolorem ex esse modi.,"Nostrum quibusdam nisi sunt. Rerum aut natus dolore alias ducimus assumenda aspernatur.
Culpa ullam repellendus pariatur optio quos dolorem. Quos dolorum vel.
Voluptates a quo vel eius magnam.",2007-04-07 23:40:46,2019-11-27 20:34:46
6472,Mollitia minus velit distinctio rem veniam.,"Distinctio optio itaque qui iusto ad magni. Eligendi eligendi quod fuga itaque vel.
Laudantium omnis voluptas cumque occaecati. Velit reiciendis doloribus voluptatem ducimus.",2011-02-21 02:55:44,2001-09-02 03:54:15
5676,Eos atque non possimus illo odit iste neque.,"Vero quo magni magni totam. Ullam sequi iure praesentium.
Nemo quisquam officia aspernatur rem harum sequi. Totam est quo expedita deleniti a dolores.",2006-09-27 08:00:18,2013-09-24 21:13:53
3338,Temporibus a dolorem earum.,"Eligendi architecto a natus dolores laboriosam. Unde nisi dolores quia enim nesciunt.
Officia ullam deleniti labore. Delectus praesentium officia itaque non fugiat voluptates saepe.",1989-07-31 15:53:56,1977-02-06 14:09:29
3159,Labore sequi architecto magni alias quod.,Eaque veniam eum expedita pariatur dolorum explicabo accusantium. Laudantium architecto corporis laudantium.,2009-09-28 17:20:32,2010-08-07 06:23:13
3456,Dolore expedita nam temporibus.,Laboriosam perferendis ea. Optio culpa in provident non.,2018-11-20 23:48:43,1994-11-04 03:20:38
6647,Velit necessitatibus quam iusto.,In maiores blanditiis facere. Asperiores iste quos in possimus veritatis nobis.,1982-11-23 02:35:02,2000-06-19 12:12:09
5862,Ut molestiae expedita vel.,Repellat eveniet eaque aliquam sapiente dolorum itaque. Consequuntur molestiae eligendi distinctio incidunt nobis.,2001-05-29 22:30:39,1991-01-30 08:08:11
9116,Velit sit maiores.,Sed porro consequatur magni. Consectetur voluptatibus quos aperiam.,1981-09-12 08:59:26,1989-11-03 12:30:42
7134,Dolorum delectus pariatur veniam nisi sed voluptates nisi.,Quisquam nesciunt odio dolore ducimus quae eum. Similique cupiditate perferendis possimus eaque quia. Illo neque ad corporis beatae voluptatem cum.,1989-06-25 22:54:12,2005-12-01 18:14:16
9172,Atque distinctio omnis nesciunt asperiores veritatis.,Minus accusantium repellat distinctio rerum eum. Minus molestiae nemo nihil rem. Dolores explicabo doloribus error aliquid. Ad minus porro dolor maxime nemo ex.,2020-08-24 21:15:26,2002-01-04 18:53:34
9137,Veniam ad sed perferendis.,Dolore ut officia non soluta amet iure. Quas quidem libero rerum. Omnis et quam doloribus ex maxime commodi. Dignissimos sunt quisquam expedita.,1987-05-30 15:18:27,1974-09-18 12:53:47
9322,Amet dignissimos nesciunt iusto.,"Dolorum fugit debitis est dicta. Quo adipisci dignissimos harum.
Molestias quod suscipit accusantium distinctio. Non debitis eos voluptatem illo.",2005-03-05 04:37:30,1971-07-11 09:27:25
6424,Odio adipisci modi.,"Labore quidem quas. Alias repudiandae nemo consectetur.
Repudiandae eos molestias ipsa neque. Exercitationem voluptatem magni asperiores. Minus illo unde odit reiciendis.",2006-01-02 07:54:12,1975-02-03 16:51:48
5757,Harum perspiciatis eius delectus assumenda nihil.,Officiis ex tenetur. Temporibus ipsum amet molestiae est perspiciatis corrupti aut.,1978-10-27 17:55:11,1978-11-15 07:51:23
797,Sint a rerum aliquid.,"Repudiandae provident quaerat occaecati a quis aliquid nihil. Architecto quae optio iure doloribus.
Provident explicabo beatae. Minima nulla quae vel. Necessitatibus sapiente commodi minus.",1992-03-11 15:56:15,1997-06-23 19:36:31
6946,Ullam eius dolorum repellendus quibusdam dicta et.,"Quasi similique alias error minus ipsam. Officia beatae non magni. Autem ab nobis.
Odit consequatur ullam inventore voluptas. Sed ab aperiam quasi.",2017-12-31 22:43:04,1982-12-23 17:37:25
8162,Voluptatibus ex ab quam nemo placeat.,Delectus rerum quo ea laudantium ea quod. Quibusdam modi veritatis amet ipsum. Iusto illum enim vero inventore.,1972-02-08 19:52:31,1984-02-06 19:55:58
5924,Sed iusto molestiae.,Perferendis repellendus rem a possimus modi ducimus eos. Deleniti reiciendis laborum ipsa culpa. Nostrum iure consequatur consequuntur. Quos nobis consectetur error expedita.,1997-09-27 18:05:41,2017-03-25 01:38:03
2201,Deserunt dolorum perspiciatis vel numquam molestias ipsum sapiente.,Praesentium omnis ab enim at quidem debitis. Eius non et placeat nam.,1981-11-18 22:35:10,1975-11-30 15:34:35
3565,Vero veritatis itaque libero.,"Sapiente deserunt mollitia occaecati iure consequatur impedit.
Non amet quas enim labore. Ut nisi unde voluptatum hic incidunt.",2017-11-30 00:37:57,1972-06-15 15:35:06
7602,Nobis dolor maiores beatae praesentium optio ab.,"Modi sint laborum molestias provident. Sit perspiciatis inventore velit necessitatibus consequuntur vel. Quae culpa saepe culpa aliquid impedit saepe.
Dicta praesentium ipsam magni dolorem.",2005-01-05 06:10:11,2011-05-06 02:19:12
5702,Rem dolores laboriosam quo aut nostrum placeat.,Quae doloribus ratione doloribus. Iure consequuntur delectus recusandae recusandae explicabo.,2006-07-03 12:42:32,2020-05-21 17:19:04
6909,Dolore corrupti repellat qui earum error magnam quae.,Ducimus recusandae eum voluptates quibusdam voluptatibus dolores accusantium. Culpa quod fugit magni ea qui odio. Ex ab ipsa eos necessitatibus. At cupiditate facilis rem deleniti rerum nesciunt.,2022-10-27 02:32:24,2018-10-26 22:27:20
7954,Cupiditate repellendus voluptatem corrupti.,Ab reiciendis minima quis provident laudantium ea. Error nihil saepe quibusdam eaque autem consequuntur. Maxime vero possimus officia dolorum expedita.,1991-05-18 16:26:16,2022-06-13 22:29:04
9917,Expedita enim nulla natus ea sint.,Suscipit quibusdam vitae nemo laudantium. Adipisci officia deleniti cumque debitis occaecati voluptate. Amet ut incidunt quidem doloribus iusto ipsum.,1990-06-06 14:29:00,2009-04-27 13:54:37
2476,Aliquid vero reprehenderit iure in in.,"Exercitationem ducimus harum adipisci ratione. Iusto provident recusandae velit quia aliquam.
Temporibus eligendi unde hic eius. Cum id hic consequuntur rerum fugit porro.",1979-04-24 04:10:12,2005-09-01 09:51:40
6056,Quos distinctio mollitia.,Ipsam nulla commodi voluptates libero distinctio. Repellendus enim sapiente soluta.,1995-04-18 19:00:17,1971-10-03 16:32:58
1633,Totam porro reprehenderit animi tempore ea.,Magni aliquid sed minus asperiores architecto rem dignissimos. Blanditiis ad dignissimos ipsum reiciendis.,1986-05-23 16:48:03,1989-07-19 16:14:27
6961,Praesentium unde ea maiores fugiat maiores suscipit quis.,Nostrum odit soluta tenetur corrupti aperiam. Aperiam tempore earum eum voluptatum voluptates.,1983-01-06 14:48:54,2022-01-09 19:37:42
3703,Eveniet iure illo molestias.,Illum sit quisquam nobis eos. Perspiciatis at mollitia magni. Non rem eligendi voluptatem dignissimos deserunt minus.,2006-01-06 23:01:51,1991-09-26 15:40:38
4902,Tempore dolorum provident officiis dolorem facere.,"Hic dolores architecto dignissimos ea. Unde omnis laborum occaecati.
Vero corrupti sit. Nihil non quis aut. Unde aliquam iure eaque.",1990-09-29 03:06:50,2013-09-12 21:07:42
1210,Repudiandae placeat explicabo harum excepturi nesciunt consectetur.,Doloremque nobis labore pariatur. Nostrum libero natus porro. Mollitia fugiat est officia sint harum. Id cum rerum fugit nulla cumque.,2002-01-31 20:09:31,2006-10-26 01:00:15
912,Deserunt soluta omnis similique officia cumque aspernatur dignissimos.,"Ea impedit ipsa sapiente perspiciatis. Quam error aperiam corrupti odit. Cumque iure nam molestiae vero nesciunt.
A labore reprehenderit cum. Nostrum incidunt dolore ex nesciunt atque.",1987-06-06 03:59:12,2021-08-21 02:56:26
4365,Blanditiis molestias officiis quibusdam.,Consectetur excepturi modi excepturi laborum officiis optio. Provident iste iusto recusandae tenetur totam modi. Assumenda odit quibusdam vitae velit sit. Vero adipisci unde consequatur modi.,1990-04-16 05:29:34,2023-01-13 05:45:48
3793,Tempore ad veniam ipsa dolores quidem.,"Illo sapiente at dicta laborum nihil. Consectetur officia sint ullam tempora explicabo beatae.
Cupiditate recusandae ipsum quis nemo. Molestiae aperiam adipisci similique hic.",2009-02-21 23:26:06,2005-01-14 01:34:17
1076,Reprehenderit quisquam perferendis est totam voluptatum atque.,Necessitatibus maiores impedit. Ut fugiat blanditiis tempora vel.,1988-10-25 15:52:17,2002-06-10 05:54:33
3522,Saepe quod suscipit fugiat.,"Placeat quia aliquam. Quaerat accusamus laudantium possimus error laudantium corrupti.
Natus commodi distinctio ab. Vitae doloremque vel repellat. Qui eaque iste quisquam tempora.",1976-06-14 05:09:16,1970-11-04 20:22:53
6082,Error eos laborum voluptatibus ex quaerat.,"Modi quas vero nihil ad eveniet.
Totam a qui saepe. Beatae quam nostrum. Sit dolorum asperiores corporis.
Asperiores nostrum natus libero enim. Voluptatibus quod assumenda nesciunt quos omnis.",2020-04-06 04:54:54,2020-06-27 12:18:47
5092,Id voluptates possimus placeat at nisi animi.,Quibusdam totam adipisci natus libero dolorum delectus excepturi. Facilis laborum saepe impedit reprehenderit.,2017-07-10 08:49:30,2021-12-17 02:42:42
2314,Quaerat doloribus numquam sint aut facilis autem.,Blanditiis facilis laborum dolore officia. Nisi fugit quaerat nobis. Expedita minus delectus minus dolor quo dignissimos.,2006-04-05 08:22:22,1971-05-29 20:18:58
5796,Rerum placeat magni placeat ab optio.,Dolores et quia laborum molestias quas tenetur. Optio expedita animi debitis quod sint. Aperiam maiores pariatur optio quo totam. Rerum nulla eaque id dicta qui aspernatur voluptate.,2013-01-16 19:30:55,2001-10-20 15:04:35
866,Excepturi iste nobis illo.,Inventore error itaque adipisci nesciunt ab dolores. Ad aliquid saepe magnam rem.,1989-05-16 00:23:24,2000-12-06 15:27:05
2213,Id in modi facilis cumque.,"Facilis eaque consequuntur eaque nam harum. Totam voluptatibus saepe sapiente dolorum natus aliquam.
Odio modi aut quasi iste. Molestiae earum totam officia.",2009-09-21 23:06:20,1987-03-27 16:08:35
4801,Eligendi ad quia enim doloremque nesciunt.,Autem occaecati consectetur unde. Et explicabo veritatis quasi expedita temporibus. Repellat nemo ducimus eum eius eveniet.,1971-06-19 16:47:51,1988-05-09 02:22:09
4457,Quasi quod cumque atque laboriosam optio.,Consectetur ipsa eum debitis perferendis. Iure laboriosam inventore tempora. Culpa illo voluptatem culpa incidunt ipsum consequuntur. Id omnis modi labore animi exercitationem omnis.,2015-03-11 03:36:22,1989-01-29 11:02:23
3289,Deleniti dolorem harum soluta.,Impedit commodi explicabo nulla harum. Nesciunt nulla dolorum hic aliquid perferendis.,1986-11-16 20:03:55,2014-06-05 16:38:16
5615,Facere aspernatur aliquid repudiandae est rerum accusamus tempore.,"Doloremque error eligendi debitis. Praesentium ex eos officia ipsa ipsam cumque harum.
Veritatis atque odio quis tempore. Ducimus quaerat libero doloremque debitis. Quas eius aliquam iure.",2000-08-24 06:01:47,2022-04-24 17:22:15
6133,Officiis sed omnis quam distinctio consequuntur libero provident.,Blanditiis perferendis quam aperiam adipisci enim fugit. Neque dolorem ratione officia nobis expedita harum consequuntur.,1998-07-21 02:24:00,2009-01-18 18:55:03
3705,Voluptatum rem excepturi eius nisi.,Ea temporibus dolorem voluptatum id molestiae dignissimos. Doloribus accusamus dolorum ex quaerat expedita animi.,2010-12-20 14:12:13,1981-10-10 17:04:29
6275,Sint possimus optio quibusdam repudiandae maiores ipsa.,Est laborum inventore quasi. Odit voluptatibus nulla delectus quibusdam quasi optio. Ea repellendus at tempora tempore accusamus nulla dolorum.,2004-09-04 18:52:16,1975-06-11 06:14:11
8472,Velit iusto excepturi fuga laudantium nihil qui at.,Reiciendis libero velit impedit eos est. Nesciunt dolorem quae nihil officia deleniti est soluta. Ipsa atque ea tempora.,1992-04-26 20:13:01,2023-02-18 11:09:07
3325,Quae deserunt iusto consectetur.,Veritatis voluptas esse exercitationem beatae vel qui. Modi nostrum nobis labore saepe exercitationem occaecati. Praesentium minus minus iusto.,1994-07-08 19:59:25,2000-07-24 17:03:41
2012,Tenetur distinctio fuga.,"Dolorum blanditiis vitae ducimus quidem officiis aliquam expedita. Laborum maxime qui cumque inventore saepe.
Velit totam repellendus eos. Amet debitis et natus debitis consectetur corrupti.",2001-07-18 06:35:00,1984-09-13 06:52:14
7738,Perspiciatis iure reprehenderit voluptas ea.,"Explicabo quibusdam est harum. Illo provident voluptatum eos illo magni. Id fugit consequuntur inventore sequi minima.
Nihil non tempore.",2015-04-05 04:53:36,1981-03-17 05:59:53
5458,Eius sint dolor vitae reprehenderit esse non.,"Ut tempore cum tempora hic. Repellendus ea quisquam necessitatibus commodi fugiat. Necessitatibus ipsa expedita possimus.
Aliquam autem cumque eum. Fugiat tempora quibusdam doloremque quia amet.",1976-03-18 11:29:50,2018-08-31 19:10:39
9971,Non amet placeat sequi exercitationem qui.,Harum fugit facere quos culpa distinctio. Repellat voluptatem iste molestiae pariatur quam harum voluptatum. Libero cum sed reiciendis.,2011-04-23 03:44:02,1990-05-12 08:15:35
9637,Cumque eaque ut repudiandae.,"Tempora perspiciatis labore. Voluptas tenetur modi nesciunt accusantium.
Voluptatem animi consequatur veniam. Distinctio placeat quae quam vel odio.",2016-04-30 20:22:58,1993-02-11 23:15:12
1212,Placeat reiciendis voluptatem dolor quaerat tenetur numquam.,"Vel aperiam exercitationem nulla odit itaque. Nisi porro nisi vero. Sequi sapiente voluptas dolores.
Possimus harum commodi non labore.",1998-07-24 13:02:42,2012-05-05 01:36:47
78,Eos impedit tempora voluptates.,Nobis voluptas doloremque iure. Asperiores esse dolore esse commodi reprehenderit sed deleniti. Esse repellat incidunt non omnis alias sapiente.,1999-12-05 12:32:15,1980-03-04 18:32:04
5631,Reiciendis delectus nisi recusandae voluptas ad doloremque.,Voluptates molestias at laboriosam officiis numquam quam. Necessitatibus commodi vitae. Quam quia vitae exercitationem fugit.,1993-08-30 16:24:54,1970-09-09 09:08:43
5234,Dolores nam neque nesciunt incidunt magnam.,"Ea perspiciatis sequi molestiae maxime saepe. Molestias iusto magni.
Recusandae fuga iste quis. Perferendis iste nihil.",1988-11-03 05:36:02,2009-09-15 01:15:17
1334,A in vitae eum.,"Pariatur cupiditate illum numquam doloremque. Eum nam voluptatibus facilis fugiat reiciendis commodi.
Velit necessitatibus saepe deserunt nemo. Consectetur qui explicabo corrupti veniam fugiat.",2001-05-21 13:39:47,2011-01-09 18:02:16
8776,Dolorum illo quae tenetur harum perferendis commodi eveniet.,Facilis possimus laudantium animi. Eos ullam eius aliquid architecto asperiores veniam asperiores.,2023-11-11 08:43:00,1971-11-28 20:01:58
9691,Laboriosam nisi pariatur alias fuga quam.,"Nihil repudiandae explicabo doloremque quidem rem iure. Vitae sequi est mollitia.
Quod voluptatum ullam tenetur officia. Modi harum commodi perspiciatis quia quam.",2010-10-04 02:38:36,2015-02-16 07:15:41
569,Iusto illo quis laboriosam.,"Error dicta quia rem nihil. Rerum libero molestiae voluptate excepturi unde veritatis.
Molestiae praesentium doloremque repellat soluta eius. In aspernatur debitis commodi repellat illo.",2015-04-14 18:22:42,2011-08-17 17:41:44
599,Voluptatibus eius dolorem ipsa.,"Cupiditate nisi enim asperiores libero atque.
Dolore autem illo architecto ratione culpa iusto sequi. Aliquam nemo ab recusandae voluptatibus error labore. Perspiciatis omnis consequuntur.",1976-06-13 20:15:07,2015-03-16 10:16:21
8690,Explicabo illum iure dolor tempore facere corrupti nisi.,Asperiores doloremque tempora cumque laudantium distinctio. Commodi possimus maxime qui. Ipsum eos quia accusamus nostrum perspiciatis.,1991-09-10 22:51:38,1986-01-13 18:28:10
7315,Quia vitae quo voluptate.,Eos at corporis animi nam libero esse ipsam. Iusto adipisci voluptatibus rerum tenetur incidunt. Dolorum inventore repellat optio amet consectetur officiis.,2009-04-12 22:27:55,1972-11-14 15:52:59
1404,Hic vitae ipsum deleniti.,Accusantium voluptatem consequatur laudantium perspiciatis. Illum ab itaque minus repellendus. Iure culpa cum iusto.,2017-07-18 07:12:38,1971-09-02 17:18:40
3300,Consequuntur quaerat sit architecto doloribus nihil ratione.,Quia dicta magnam repellat doloribus ratione. Sint vitae quia molestias ipsam itaque reprehenderit. Dolores reprehenderit quos aliquid consequatur minus.,1976-07-17 05:39:28,2019-01-12 19:50:37
2913,Iure id officiis unde illum.,"Enim quaerat porro quia. Recusandae exercitationem aliquid explicabo nesciunt. Id totam maxime molestias distinctio recusandae.
Beatae quas inventore. Est nesciunt ex odit molestias voluptatibus.",1981-12-31 00:28:59,1993-08-08 17:07:40
574,Ullam cum voluptate.,Atque esse ex. Expedita voluptatum illum quasi neque soluta saepe. Repudiandae incidunt aperiam tempore corrupti omnis illum.,2012-12-22 01:48:34,1980-12-24 02:28:52
5756,Consequuntur nemo eius.,"Numquam in necessitatibus nam quo assumenda facilis at.
Eius quia reiciendis optio corporis ipsum. Ea odit eveniet iusto.",1971-04-17 19:23:37,1988-06-01 20:21:58
4959,Impedit deleniti itaque ex assumenda excepturi.,Officiis aliquam cupiditate accusantium corrupti veritatis. Velit odit accusamus odit voluptas quia. Reprehenderit aperiam delectus id dolores quidem.,2008-05-03 16:22:45,1972-06-16 12:40:39
7211,Doloremque maxime ratione.,Tempora repellat quasi itaque maiores exercitationem pariatur. Deserunt occaecati tempora architecto. Explicabo provident omnis maiores vel est.,2008-12-19 11:13:53,1979-03-22 21:13:43
3135,Quisquam hic harum odit.,Non dolorum illum pariatur. Veniam incidunt deserunt exercitationem. Repellendus inventore deleniti omnis iure similique ducimus.,1995-10-14 17:24:48,1998-01-14 01:53:04
6125,Ratione quaerat debitis illo quia quia.,"Porro illum cum mollitia laboriosam deserunt similique. Quis placeat molestias vitae eum omnis minima. Vero sequi magni natus enim non aperiam.
Cupiditate necessitatibus ut dolorum repellendus.",1970-07-23 06:27:19,1982-09-23 17:59:36
2591,Ipsa nesciunt labore.,"Sint harum ipsam odio temporibus accusamus impedit. Ducimus ipsam vitae fuga beatae optio.
Sapiente voluptatibus facilis. Ipsum nostrum distinctio aliquam repellendus totam.",1991-04-15 06:27:54,1981-12-05 04:07:37
3180,Dolore cumque hic totam amet ducimus corrupti ratione.,"A accusamus ad a. Ab placeat numquam ipsa. Inventore beatae officia id.
Corrupti est ipsa nulla optio optio sed. Sed praesentium exercitationem similique. Doloremque laboriosam a mollitia.",2007-11-21 12:48:21,2004-03-03 01:19:21
9973,Beatae ipsam totam ipsum illo deserunt.,Harum omnis et. Nesciunt debitis repellendus natus sapiente aliquid delectus rem.,1996-01-21 09:20:15,1974-12-22 21:01:28
2042,Velit non soluta voluptas.,Perferendis aperiam quam ipsum. Unde odio nulla architecto illum aspernatur.,2013-06-07 11:02:24,2014-01-02 22:25:48
707,Odio dignissimos cum odio quis est expedita.,Dignissimos omnis beatae eos. Maiores dicta facere corporis itaque accusamus. Ducimus neque dolor enim adipisci occaecati laudantium pariatur.,1985-07-14 21:04:01,2021-02-02 22:21:08
9296,Esse laudantium qui voluptatibus.,Nihil eius rem laudantium officiis. Iusto ea accusantium maiores nulla reiciendis.,1984-12-04 15:40:07,2009-05-22 19:41:23
6332,Quo inventore nesciunt iure optio.,"Tenetur architecto molestias quos pariatur. Nesciunt optio commodi iure aliquid molestiae recusandae.
Nisi quasi voluptatibus fugit veniam quis perspiciatis labore. Ratione quisquam quidem.",1971-03-07 07:02:10,1975-09-08 22:37:15
7252,Veritatis molestias autem.,Repudiandae cumque rem provident. Amet suscipit accusamus.,2014-07-28 13:12:51,2023-11-01 09:58:36
4274,Reprehenderit amet sed.,Totam consectetur laborum omnis quidem ratione. Quaerat quo consequatur qui.,2023-01-23 15:02:48,1986-02-26 23:11:27
3478,Et excepturi veniam accusantium dolore.,"Laudantium blanditiis accusamus sint modi blanditiis aspernatur a. Unde nobis vel ut eum. Earum ullam quis.
Eaque fugit inventore dolorem repellat a.",1988-09-24 21:56:46,1996-10-09 23:50:12
2232,Tempora rerum quia placeat eaque ducimus dolore a.,Ut a cupiditate fuga aut voluptate. Temporibus laboriosam adipisci repellendus natus a. Accusantium cumque reiciendis quo. Velit maiores voluptas dolorum nobis.,1979-11-19 06:52:15,1984-11-16 13:14:32
3200,Nisi voluptates reiciendis corrupti dignissimos.,Sequi expedita tenetur ratione rerum accusantium itaque. Reiciendis voluptatem voluptatibus praesentium veritatis nobis minima. Perspiciatis exercitationem modi explicabo autem quos.,2004-04-19 22:38:04,1974-06-17 06:45:03
4104,Dicta quasi nemo alias.,"Itaque dolor dolores est illum. Vel quod accusantium a a. Quisquam quo iste error blanditiis.
Deserunt aliquid alias ratione deserunt ipsa. Veritatis praesentium et. Voluptate labore quidem.",2020-02-26 00:35:25,2021-04-10 21:10:24
