id,title_content,description,created_at,updated_at
4506,Perferendis ipsa eos soluta.,Accusamus velit perferendis hic neque. Facere repellendus corporis non earum iure.,2010-04-16 02:08:09,1980-08-15 10:20:45
7497,Impedit earum asperiores et delectus.,Eum repellat placeat deleniti sed dolorem rerum. Corporis soluta maxime corporis eius ullam. Sapiente natus itaque veniam dicta. Reiciendis dicta a veniam maxime laborum veritatis soluta.,1970-09-28 00:32:12,2019-11-29 16:52:06
406,Assumenda voluptatum dolorem dolor.,"Quisquam nesciunt quae illo. Molestias blanditiis hic voluptatibus veniam beatae.
Dicta consequatur itaque. Eveniet qui porro odio. Eveniet molestias magni fuga accusamus fugiat.",1989-03-12 17:34:15,1993-12-10 01:22:02
4545,Distinctio facilis alias dolores eum reiciendis aperiam.,"Tenetur officia repellendus. Ullam vero dolor eveniet veniam rerum eaque.
Nam voluptatibus quas mollitia saepe corporis in. Deleniti rem inventore optio.
Assumenda aperiam cumque voluptatibus et.",1992-06-15 13:26:16,1978-09-14 05:35:22
1471,Magni numquam vitae laborum.,Qui optio dolore nostrum recusandae. Maxime aliquid laborum quisquam nostrum corrupti facilis.,2017-05-06 08:59:44,1983-03-04 16:33:50
1484,Eveniet quo alias dicta nulla consectetur.,"Amet eum iste delectus aut sapiente maiores quaerat. Voluptate alias rem debitis porro.
Culpa eos sequi corporis. Accusantium eum vitae id non. Facilis corporis possimus natus blanditiis praesentium.",2012-03-22 13:53:55,1999-07-22 13:26:36
4759,Repudiandae nihil laudantium impedit.,Eligendi magni voluptates earum fuga perferendis minima. Neque officiis animi.,1971-12-21 16:52:16,1974-03-25 13:13:46
5121,Incidunt suscipit nobis quam.,"Ipsa animi totam quaerat. Sunt cumque odit. A beatae natus asperiores perspiciatis.
Ut blanditiis quasi quaerat. Molestiae repudiandae delectus possimus saepe suscipit alias ut.",2018-11-02 04:57:17,1987-04-27 05:31:29
846,Molestiae accusamus quis quia.,Nisi tempore excepturi velit repellendus suscipit blanditiis architecto. Laboriosam occaecati sit repellendus magni eos. Beatae totam minima sit ipsum.,2011-07-26 19:52:48,2022-12-16 02:49:58
6545,Nobis magnam error.,"Quisquam eum neque ducimus eaque harum error. Nemo alias blanditiis quos.
Voluptatibus fugiat error cumque. Quia excepturi fuga tempore repellat in.",1986-01-27 05:54:54,1988-11-06 11:17:02
8598,Tempora inventore esse corporis.,"At nostrum necessitatibus deserunt.
At sapiente dolorum vel sint ad quos. Cupiditate repellendus quis amet similique doloremque.",2014-03-19 12:46:54,2009-12-14 09:41:55
9342,Eum alias delectus praesentium asperiores ducimus.,"Similique sed vero qui minima. Eaque voluptatibus maxime ratione.
Vel perferendis non asperiores. Esse possimus rerum non id rem. Dicta sint eius explicabo error.",1998-10-22 06:06:06,1994-11-28 08:03:10
9640,Odio ad eos laboriosam corporis.,"Tempore inventore impedit. Maiores doloribus consectetur eveniet.
Ut ipsum exercitationem veritatis. Corporis dignissimos iusto cum culpa asperiores.",2012-03-18 11:17:46,2014-04-17 12:13:52
6990,Occaecati ab delectus et.,Fuga reiciendis nostrum temporibus. Placeat tempora mollitia nemo provident ducimus. Occaecati odit magnam numquam qui nostrum.,2006-02-20 04:42:47,2012-02-16 05:02:56
1982,Error vitae sequi quo nisi delectus.,"At modi non aspernatur illo unde. Culpa adipisci vero ab voluptas.
Voluptate maiores velit laborum blanditiis. Ex tempore dolorem at corrupti aspernatur ad animi.",1980-04-05 18:43:06,1972-09-03 10:27:20
7876,Inventore necessitatibus eum pariatur rerum cumque ad.,"Maiores perferendis saepe iste. Nobis reprehenderit odio nisi nulla soluta exercitationem. Dignissimos libero placeat corrupti.
Magnam ut adipisci iste.",1984-12-26 23:07:18,2017-11-05 12:04:48
5727,Ea suscipit repudiandae.,"Vero porro voluptatum consequatur. Aliquid veniam quisquam occaecati provident.
Pariatur corporis a adipisci quidem repellendus. Suscipit nihil quo non eum.",1984-02-04 08:53:17,2000-02-03 12:39:48
172,Quibusdam eius illum non eum commodi dicta.,Voluptatum qui officiis placeat. Voluptates sed soluta saepe commodi a repudiandae. Dolorum impedit illo culpa corporis at.,2009-07-23 12:50:02,2009-04-26 04:36:20
3004,Non quaerat qui ipsum optio.,Sapiente animi eos consequatur. Magnam sint labore dicta quod vero possimus. Natus incidunt distinctio officia praesentium quis incidunt.,2011-06-25 19:35:11,1972-12-13 13:37:56
7365,Necessitatibus aspernatur accusantium nesciunt.,Possimus quibusdam maxime beatae ipsa repellat sequi. Numquam sint ratione facere. Ad a est numquam qui assumenda eaque.,1996-06-14 18:26:35,2001-02-14 14:23:23
4186,Sapiente qui nihil numquam.,Suscipit soluta aliquam magnam vero. Debitis unde sequi maxime saepe.,2003-01-02 03:54:38,1974-10-19 05:00:38
4484,Labore modi accusamus blanditiis qui distinctio.,"Consequatur deserunt error rem quibusdam non. Nam totam ex dolor.
Labore ut quo expedita iusto nesciunt eligendi laudantium.
Optio laborum quam alias provident accusamus. Fugit maiores quod commodi.",1979-09-27 04:20:08,1990-09-16 03:02:42
3163,Laboriosam ipsum quam repudiandae aliquam autem velit cupiditate.,Repellat eum eaque. Dignissimos nam unde praesentium. Pariatur nisi aspernatur animi laudantium enim ipsam. Omnis provident maiores sunt dignissimos doloribus.,1992-06-13 23:11:14,1976-02-09 02:00:18
2114,Architecto saepe aut occaecati ea alias hic.,Commodi aperiam commodi ullam reprehenderit architecto. Quia blanditiis voluptate fugiat labore nobis recusandae.,2013-01-24 10:52:57,2004-07-23 05:16:51
7860,Doloremque quae voluptates sunt tempora.,"Nulla quod iure iusto error. Suscipit vitae reprehenderit nam mollitia veniam cupiditate.
Sunt dicta dolore atque vitae. Ducimus possimus harum assumenda.",2017-03-10 18:38:16,1998-04-26 12:06:05
1147,Fuga officiis itaque.,Corrupti distinctio adipisci at voluptates. Dolore praesentium asperiores deserunt voluptatibus ut.,1980-09-11 20:41:53,1988-11-06 20:01:56
8105,Aut rerum architecto sequi error labore impedit.,Quidem architecto dolore. Non sed corrupti magnam nulla odit quis. Reprehenderit temporibus unde suscipit accusamus iusto.,2003-03-07 22:03:22,2001-02-24 18:38:35
9018,Doloribus assumenda ducimus inventore.,"Ad tempora nostrum eligendi eius. Odit tempore dolorum nostrum voluptate vel praesentium. Vel nulla ipsa eaque.
Nobis ut iste placeat magni quos at. Consequatur eius quae enim excepturi optio.",2007-07-08 13:44:35,1988-04-30 09:55:05
8518,Debitis tempore iure ea deserunt consectetur.,Voluptatem vel facilis porro amet nostrum. Inventore perspiciatis aperiam ullam.,1976-08-20 03:08:49,1989-10-12 08:49:44
8011,Nostrum quisquam ipsa nulla occaecati quia quia.,Rem quibusdam voluptatum. Optio architecto pariatur et magnam sint ducimus nam. Doloribus sit molestias quasi assumenda alias. Deleniti debitis neque quod eum optio voluptatibus consequuntur.,1985-07-17 07:36:40,2002-04-19 00:07:11
8469,Veritatis enim odio eum quo esse ex.,"Esse praesentium at reprehenderit.
Voluptatibus tempore soluta ex dolores accusantium. Ad in nobis quod.
Rem odit exercitationem iure amet. Voluptatibus delectus tempora eaque.",1984-07-31 00:29:48,1998-11-12 02:13:28
3113,Tempore architecto quis.,"Minus animi animi asperiores. Nulla corrupti nobis iure deserunt. Ad nemo nulla doloremque dolore.
Totam aliquam ipsum autem dolore nisi. Amet explicabo veniam perferendis ratione ab.",1982-09-08 06:32:15,1990-03-13 23:05:02
4037,Voluptatum quas odit expedita vel veritatis voluptates.,"Eum temporibus itaque corporis officia sequi. Esse alias quia laboriosam velit ab.
Minus tenetur recusandae doloremque eaque. Omnis fugiat deleniti suscipit architecto aspernatur.",1997-05-03 13:14:02,1989-04-30 08:51:36
2365,Veritatis similique totam recusandae.,"Aspernatur magnam tenetur ullam. Ad dicta reiciendis. Ab dignissimos iure itaque.
Assumenda quam accusamus amet eum animi vero. Dicta excepturi neque odio fuga illum sit animi.",1981-08-22 05:57:15,2024-05-11 03:01:07
1282,Suscipit quae incidunt autem rerum sunt.,Sunt ad sapiente tenetur ab necessitatibus. Perspiciatis in incidunt a ad occaecati harum incidunt.,1983-12-14 09:44:25,1977-08-02 08:03:55
2580,Dolorum doloremque quasi dolor voluptas quam similique.,"Maxime nihil debitis at quia recusandae.
Iste sed eos alias labore. Perferendis optio odio voluptatem atque eveniet.",2010-02-11 11:55:57,2020-03-16 22:59:49
4977,Tempora ullam modi porro assumenda.,Optio ad excepturi aspernatur quasi. Consectetur a quidem vero quos veniam vitae pariatur. Accusamus maiores pariatur est.,1981-02-14 02:26:09,2008-08-20 11:08:37
3135,Tempora impedit eveniet reiciendis libero.,"Magni consequatur numquam nemo ab quis sapiente. Labore nesciunt officia molestias.
Porro eos sit. Dolor porro omnis fugit nobis repellendus. Dolore laudantium possimus sunt sit.",2012-06-19 13:33:40,1997-01-24 10:08:11
